26,667942f7c6750e001280c047,645065cb5a75be0012ab1447,64b63edf1d22aa001389c821,65673827e7adcf001210f96e,Warehouse Supervisor,warehouse-supervisor,3,warehouse-supervisor-3,False,,False,,<ul><li>Berkoordinasi untuk mengatur kegiatan Inbound dan Outbound</li><li>Memastikan SOP yang berjalan di Warehouse berjalan dengan lancar</li><li>Memonitor pelaksanaan perawatan perlengkapan Warehouse</li><li>Membuat laporan secara periodik</li><li>Memantau pelaksanaan 5R di bagiannya</li></ul>,"<ul><li>Pendidikan minimal S1</li><li>Pengalaman minimal 1 tahun di bidang yang sama</li><li>Memiliki kemampuan mengelola kegiatan pengiriman barang</li><li>Memiliki kemampuan terkait Supply Chain Management / Warehouse Management</li><li><strong>Penempatan: Deltamas, Cikarang</strong></li></ul>",[],,['belinda.werdiningsih@enseval.com'],['fullTime'],onSite,paid,,True,False,False,True,2024-06-24T09:57:11.980Z,"[{'id': '64844687827a42e574746f17', 'type': 'date', 'title': ""When's your birthday?"", 'mandatory': True, 'description': None}, {'id': '667944166f8c260012aca18d', 'type': 'radio', 'title': 'Apakah bersedia untuk ditempatkan di Deltamas, Cikarang?', 'mandatory': True, 'description': None, 'radio': {'options': [{'id': '667944166f8c260012aca18e', 'value': 'Yes'}, {'id': '667944166f8c260012aca18f', 'value': 'No'}]}}, {'id': '667944166f8c260012aca190', 'type': 'shortText', 'title': 'Berapa lama pengalaman Anda memimpin Warehouse dan berapa banyak anggota yang anda pimpin?', 'mandatory': True, 'description': None}]",active,48,,,,False,[],,[],True,,False,False,0,False,[],2024-06-24T09:57:11.986Z,2024-06-25T06:45:27.769Z,2024-06-24T09:57:11.983Z,2024-06-25T04:15:09.949Z,"[{'canSeeApplicants': True, 'email': 'belinda.werdiningsih@enseval.com', 'canViewSalary': True, 'canProcessCandidate': True, 'order': 1}, {'canSeeApplicants': True, 'email': 'rachel.mulyo@enseval.com', 'canViewSalary': True, 'canProcessCandidate': True, 'order': 2}, {'canSeeApplicants': True, 'email': 'claudia.wahyudi@enseval.com', 'canViewSalary': True, 'canProcessCandidate': True, 'order': 3}, {'canSeeApplicants': True, 'email': 'chelsea.tiffany@enseval.com', 'canViewSalary': True, 'canProcessCandidate': True, 'order': 4}]",False,False,2024-06-24T09:48:28.015Z,7,8,8,False,65673827e7adcf001210f96e,Admin & Ops,2023-11-29T13:09:59.360Z,102.0,Indonesia,181.0,Bekasi,,"[5, 6, 7]",,,[],[],207,46,645065cb5a75be0012ab1447,PT.Enseval Putera Megatrading Tbk,ptenseval-putera-megatrading-tbk,,,,"['competitiveSalary', 'medicalLeave', 'bonusSystem', 'periodLeave']",['onSite'],Pharmaceutical Manufacturing,https://cdn.sejutacita.id/645062b3bcd1810013e71a67/JobPortalCompanyLogo/227545ca-91d6-4227-a35b-a2ef269d6534.jpg,,"<p>Enseval as Indonesia's largest Healthcare Product Distribution Company has been reached all areas in Indonesia through its 48 branches. Furthermore, Enseval also expanded its contribution of Indonesia’s better health service through selling raw materials for pharmaceuticals and cosmetics purpose, as well as medical and health diagnostic tools.</p><p><br></p><p>Enseval has the vision to be a leading and integrated distribution and logistics company through service excellence, competent people and advanced technology. This vision is followed by the company’s mission to contribute in improving the quality of health and delivering the best health care products for Indonesia.</p><p><br></p><p>Through the passion and commitment for providing better quality of health for Indonesia’s families, Enseval has been grown to have 46 branches all over big cities in Indonesia and five subsidiaries that run business in various areas:</p><p><br></p><p>PT Tri Sapta Jaya – operates in distribution sector for pharmaceutical and health care products. The company focus is more to expand its delivery line in lower market segments and more remote areas.</p><p><br></p><p>PT Millenia Dharma Insani – providing health services through building clinics namely Mitra Sana. The main idea of this company is to offer affordable and integrated health facilities, consisting clinics, pharmacies, and mini markets.</p><p><br></p><p>PT Enseval Medika Prima – focus more in marketing and trading sectors, particularly trading and marketing of health devices.</p><p><br></p><p>PT Global Cemindo Megatrading – is a company that concentrates in selling raw materials, as due to rapid growth in such business sectors.</p><p><br></p><p>PT Renalmed Tiara Utama – the company mission is to acquire the business from third parties to supply materials and hemodialysis machines for kidney failure patients to multiple hospitals and clinics.</p><p><br></p><p>With its contribution in enhancing quality of life in Indonesia for more than 42 years, Enseval touches so many people lives in so many different ways</p>",https://www.enseval.com,enseval.com,,,,2023-05-02T01:22:19.364Z,2024-06-25T06:42:56.167Z,159,Jakarta Timur,102,Indonesia,[],[],,,,,,False,True,['SDR'],,False,,11326,"[{'linkedInUrl': 'https://www.linkedin.com/in/djonny-hartono-49219b19/', 'role': 'Managing Director at PT.Enseval Putera Megatrading Tbk', 'headline': None, 'name': 'Djonny Hartono', 'photoUrl': 'https://cdn.sejutacita.id/63983cf268e6b200152ce01f/Others/0c2fb752-dfe1-4ed5-9f37-34b60eb848e9.png'}, {'linkedInUrl': 'https://www.linkedin.com/in/tanthio/', 'role': ' Head of Commercial', 'headline': None, 'name': 'Alexander Stefan Tanthio', 'photoUrl': 'https://cdn.sejutacita.id/63983cf268e6b200152ce01f/Others/41b5999c-1640-4c2c-a917-35424358619c.png'}, {'linkedInUrl': 'https://www.linkedin.com/in/claudia-winandya-wahyudi-81146bb3/', 'role': 'Talent Acquisition Specialist at PT.Enseval Putera Megatrading Tbk', 'headline': None, 'name': 'Claudia Winandya Wahyudi', 'photoUrl': 'https://cdn.sejutacita.id/63983cf268e6b200152ce01f/Others/9d242df4-bef6-4439-9e75-580b4003cb55.png'}]",,False,3,nonStartup,[],[],[],[],False,0,-1,,,587966,pt-enseval-putera-megatrading-tbk-14fa56,ptenseval-putera-megatrading-tbk,0,True,True,63e0c23d8c574700140623a5,riani.pratiwi@usedeall.com,,,,,,,,
27,66793b0d6f8c260012aa9ea1,645065cb5a75be0012ab1447,645061cbbcd1810013e71a45,630cfd2551c6b2001373125e,Salesman - Denpasar,salesman-denpasar,0,salesman-denpasar,False,,False,,"<ul><li>Mencari pelanggan potensial, memperkenalkan produk, dan menjual produk perusahaan kepada mereka.</li><li>Bertanggung jawab atas mencapai target penjualan yang telah ditentukan oleh perusahaan.</li><li>Berinteraksi dengan pelanggan, menawarkan penawaran, dan melakukan negosiasi untuk mencapai kesepakatan penjualan.</li><li>Melakukan penagihan kepada pelanggan sesuai dengan persyaratan yang telah disepakati.</li></ul>",<ul><li>Pendidikan min. Diploma (D3).</li><li>Dapat mengendarai motor (memiliki SIM C).</li><li>Kemampuan komunikasi dan pemasaran yang baik.</li><li>Gigih dan inovatif.</li><li>Penempatan di Bandar Lampung.</li></ul>,[],,['rachel.mulyo@enseval.com'],['fullTime'],onSite,paid,,True,False,False,True,2024-06-24T09:23:25.124Z,[],active,1,,,,False,[],,[],True,,False,False,0,False,[],2024-06-24T09:23:25.133Z,2024-06-25T06:06:31.492Z,2024-06-24T09:23:25.128Z,2024-06-24T09:23:25.124Z,"[{'canSeeApplicants': True, 'email': 'rachel.mulyo@enseval.com', 'canViewSalary': True, 'canProcessCandidate': True, 'order': 1}, {'canSeeApplicants': True, 'email': 'belinda.werdiningsih@enseval.com', 'canViewSalary': True, 'canProcessCandidate': True, 'order': 2}, {'canSeeApplicants': True, 'email': 'chelsea.tiffany@enseval.com', 'canViewSalary': True, 'canProcessCandidate': True, 'order': 3}, {'canSeeApplicants': True, 'email': 'claudia.wahyudi@enseval.com', 'canViewSalary': True, 'canProcessCandidate': True, 'order': 4}]",False,False,2024-06-24T09:48:28.015Z,3,8,8,True,630cfd2551c6b2001373125e,Business Dev & Sales,2022-08-29T17:53:41.250Z,102.0,Indonesia,282.0,Denpasar,,"[0, 5]",,,[],[],62,1,645065cb5a75be0012ab1447,PT.Enseval Putera Megatrading Tbk,ptenseval-putera-megatrading-tbk,,,,"['competitiveSalary', 'medicalLeave', 'bonusSystem', 'periodLeave']",['onSite'],Pharmaceutical Manufacturing,https://cdn.sejutacita.id/645062b3bcd1810013e71a67/JobPortalCompanyLogo/227545ca-91d6-4227-a35b-a2ef269d6534.jpg,,"<p>Enseval as Indonesia's largest Healthcare Product Distribution Company has been reached all areas in Indonesia through its 48 branches. Furthermore, Enseval also expanded its contribution of Indonesia’s better health service through selling raw materials for pharmaceuticals and cosmetics purpose, as well as medical and health diagnostic tools.</p><p><br></p><p>Enseval has the vision to be a leading and integrated distribution and logistics company through service excellence, competent people and advanced technology. This vision is followed by the company’s mission to contribute in improving the quality of health and delivering the best health care products for Indonesia.</p><p><br></p><p>Through the passion and commitment for providing better quality of health for Indonesia’s families, Enseval has been grown to have 46 branches all over big cities in Indonesia and five subsidiaries that run business in various areas:</p><p><br></p><p>PT Tri Sapta Jaya – operates in distribution sector for pharmaceutical and health care products. The company focus is more to expand its delivery line in lower market segments and more remote areas.</p><p><br></p><p>PT Millenia Dharma Insani – providing health services through building clinics namely Mitra Sana. The main idea of this company is to offer affordable and integrated health facilities, consisting clinics, pharmacies, and mini markets.</p><p><br></p><p>PT Enseval Medika Prima – focus more in marketing and trading sectors, particularly trading and marketing of health devices.</p><p><br></p><p>PT Global Cemindo Megatrading – is a company that concentrates in selling raw materials, as due to rapid growth in such business sectors.</p><p><br></p><p>PT Renalmed Tiara Utama – the company mission is to acquire the business from third parties to supply materials and hemodialysis machines for kidney failure patients to multiple hospitals and clinics.</p><p><br></p><p>With its contribution in enhancing quality of life in Indonesia for more than 42 years, Enseval touches so many people lives in so many different ways</p>",https://www.enseval.com,enseval.com,,,,2023-05-02T01:22:19.364Z,2024-06-25T06:42:56.167Z,159,Jakarta Timur,102,Indonesia,[],[],,,,,,False,True,['SDR'],,False,,11326,"[{'linkedInUrl': 'https://www.linkedin.com/in/djonny-hartono-49219b19/', 'role': 'Managing Director at PT.Enseval Putera Megatrading Tbk', 'headline': None, 'name': 'Djonny Hartono', 'photoUrl': 'https://cdn.sejutacita.id/63983cf268e6b200152ce01f/Others/0c2fb752-dfe1-4ed5-9f37-34b60eb848e9.png'}, {'linkedInUrl': 'https://www.linkedin.com/in/tanthio/', 'role': ' Head of Commercial', 'headline': None, 'name': 'Alexander Stefan Tanthio', 'photoUrl': 'https://cdn.sejutacita.id/63983cf268e6b200152ce01f/Others/41b5999c-1640-4c2c-a917-35424358619c.png'}, {'linkedInUrl': 'https://www.linkedin.com/in/claudia-winandya-wahyudi-81146bb3/', 'role': 'Talent Acquisition Specialist at PT.Enseval Putera Megatrading Tbk', 'headline': None, 'name': 'Claudia Winandya Wahyudi', 'photoUrl': 'https://cdn.sejutacita.id/63983cf268e6b200152ce01f/Others/9d242df4-bef6-4439-9e75-580b4003cb55.png'}]",,False,3,nonStartup,[],[],[],[],False,0,-1,,,587966,pt-enseval-putera-megatrading-tbk-14fa56,ptenseval-putera-megatrading-tbk,0,True,True,63e0c23d8c574700140623a5,riani.pratiwi@usedeall.com,,,,,,,,
28,66792b718974d60012da7e9b,657bbf53fb96850012fba0f2,657bbded4c1f770013d8517d,630cff8c9c338f0012831274,Reguler Internal Audit Senior Associate,reguler-internal-audit-senior-associate,0,reguler-internal-audit-senior-associate,False,,False,,"<ul><li>Melakukan pemeriksaan internal audit berdasarkan surat tugas yang diberikan</li><li>Menyusun persiapan untuk pelaksanaan audit dengan memastikan perencanaan terimplementasi dengan baik</li><li>Menganalisa Risk Based Audit sekaligus menentukan item-item pemeriksaan yang merupakan fokus audit saat field work</li><li>Menyusun laporan audit di lapangan meliputi kertas kerja, dokumen pendukung dan sistem/prosedur yang digunakan, serta point temuan audit dan tanggapan auditee</li><li>Membuat laporan hasil pemeriksaan audit internal dan memberikan masukan kepada Owner Process terkait improvement pekerjaan dan mitigasi risiko</li><li>Memantau proses rekomendasi audit dan sanksi yang ditetapkan</li><li>Memberikan masukan kepada Internal audit development jika diperlukan pembaruan untuk audit internal</li><li>Melakukan monitoring terhadap laporan fraud, melakukan fraud Investigation dan membuat laporan fraud investigation</li></ul>","<ul><li>Lulusan Sarjana/S1</li><li>Bersedia di tugaskan ke luar kota</li><li>Pengalaman kerja sebagai Audit di Logistik/Expedisi</li><li>Pengalaman kerja sebagai Audit IT</li><li>Memiliki Sertifikasi ISO 27001 : 2022</li><li>Memiliki Sertifikasi ISO 9001 : 2015</li><li>Analytical thinking, Detail Oriented, Meticulous,</li><li>Able to use MS Office well, Power BI dan Advanced Excell</li><li>Risk Analysis, Risk Assessment</li><li>Fraud Analysis, Fraud investigation</li><li>Good Communicaton for presentations</li><li>Compliance</li><li>Able to work in team and individually</li></ul>",[],,['ardiansyah.ardi@anteraja.id'],['fullTime'],hybrid,paid,,True,False,False,True,2024-06-24T08:16:49.227Z,"[{'id': '667945c396007700121aa11c', 'type': 'radio', 'title': 'Gender', 'mandatory': True, 'description': 'preferably male', 'radio': {'options': [{'id': '667945c396007700121aa11d', 'value': 'Male'}]}}]",active,31,,,,False,[],,[],True,,False,False,0,False,[],2024-06-24T08:16:49.234Z,2024-06-25T06:44:54.216Z,2024-06-24T08:16:49.231Z,2024-06-25T02:47:53.147Z,"[{'canSeeApplicants': True, 'email': 'ardiansyah.ardi@anteraja.id', 'canViewSalary': True, 'canProcessCandidate': True, 'order': 1}]",False,False,2024-06-18T04:33:50.214Z,7,8,8,False,630cff8c9c338f0012831274,Finance & Accounting,2022-08-29T18:03:56.071Z,102.0,Indonesia,49181.0,Indonesia,,"[6, 5, 7]",,,"['62fbb7c6f14e6f0013b2abdf', '63b79d626a55240012183ad5', '6226f6692d9a642279775ac4', '6374d62c00ab7a00129bd27c', '627e719585ee4e001622d95b']","[{'id': '62fbb7c6f14e6f0013b2abdf', 'name': 'Process Improvement', 'addedByUser': True, 'editedBy': None, 'status': 'notProcessed', 'count': 144, 'createdAt': '2022-08-16T15:29:10.274Z'}, {'id': '63b79d626a55240012183ad5', 'name': 'SOP', 'addedByUser': True, 'editedBy': None, 'status': 'notProcessed', 'count': 28, 'createdAt': '2023-01-06T04:02:42.967Z'}, {'id': '6226f6692d9a642279775ac4', 'name': 'Risk Management', 'addedByUser': False, 'editedBy': None, 'status': 'notProcessed', 'count': 436, 'createdAt': '2022-03-07T17:00:00.000Z'}, {'id': '6374d62c00ab7a00129bd27c', 'name': 'Fraud Investigation', 'addedByUser': True, 'editedBy': None, 'status': 'notProcessed', 'count': 43, 'createdAt': '2022-11-16T12:23:08.378Z'}, {'id': '627e719585ee4e001622d95b', 'name': 'Analytical Thinking', 'addedByUser': True, 'editedBy': None, 'status': 'notProcessed', 'count': 1668, 'createdAt': '2022-05-13T14:56:21.439Z'}]",82,30,657bbf53fb96850012fba0f2,Anteraja,anteraja,,,,"['competitiveSalary', 'medicalLeave', 'bonusSystem']",['onSite'],Freight And Package Transportation,https://cdn.sejutacita.id/657bbded4c1f770013d8517d/JobPortalCompanyLogo/108eaa76-352c-430e-aa7c-b4b6e9042b20.jpeg,,"<p>Anteraja is a company that moves within delivery service and logistics, spanning over the far-east of Indonesia to the far-west. Of course, it’s only necessary that every service that we offer come with an app, and it doesn’t stop there–– our system is fully automated by a network of artificial intelligence (AI).</p><p>Not only we care about intellects and talents of our human resources, we also care about giving back to the community. Our culture is stemmed from the notion of #JadiOrangBaik, which directly translates to ‘be a person of kindness’. We believe in democratizing our services and to help independent businesses grow with the tools that we offer to them.</p><p>Our investors include PT Adi Sarana Armada. Tbk, PT Semangat Bambu Runcing, and Time Prestige International, Ltd.</p>",https://www.anteraja.id,anteraja.id,100,,,2023-12-15T02:52:03.691Z,2024-06-25T06:39:29.023Z,158,Jakarta Selatan,102,Indonesia,[],[],,,,,,False,True,['SDR'],,False,,2792,[],,False,3,nonStartup,[],[],[],[],False,0,-1,,,,anteraja-fe961d,anteraja,0,True,True,63e0c23d8c574700140623a5,riani.pratiwi@usedeall.com,,,,,,,,
29,658127f56d1e8400133f12d0,62a838e7115f840012904d19,63da33c98c5747001405defc,62c832d3d4471a00132d8a18,ID Translator Copywriter (Junior),id-translator-copywriter,0,id-translator-copywriter,False,,False,,"<ul><li>Translate articles and advertisements from English to the local language, <strong>using SEO techniques</strong>.</li><li>Perform <strong>technical vocabulary translations</strong> of content about hosting and website creation tools.</li><li><strong>Optimize content</strong> with a focus on SEO and conversions.</li><li>Search for keywords used in content searches in <strong>local markets</strong>.</li><li><strong>Adapt content in English for the local market</strong>.</li><li>Keep the translations of our localized websites <strong>up to date</strong>.</li><li><strong>Crosscheck translations</strong> to ensure the quality and consistency of our work.</li><li><strong>Proceed with market research and competitor analysis</strong> to ensure our top position in the local market.</li></ul>","<ul><li><strong>Experience with localization at least 1 year.</strong></li><li><strong>Experience in content translation</strong>.</li><li><strong>Experience with marketing terminology</strong>: Familiarity with marketing jargon, slogan, customer behavior, and persuasive language in the target language</li><li>Excellent project and time management skills.</li><li>Excellent <strong>verbal and written skills in Bahasa</strong>.</li><li><strong>C1 or fluent written and speaking&nbsp;English proficiency.</strong></li><li><strong>Good to have skills: </strong>CAT (Computer-Assisted Translation) tools.</li><li><strong>Good to have skills: </strong>Have notions of HTML.</li><li><strong>Good to have skills</strong>: Knowledge and/or experience in website development, WordPress, and the hosting market.</li></ul>",[],,[],['fullTime'],remote,paid,,True,False,True,True,2023-12-19T05:19:49.103Z,"[{'id': '658132226d1e8400133fd986', 'type': 'radio', 'title': 'How would you rate the proficiency of your spoken and written English?', 'mandatory': True, 'description': None, 'radio': {'options': [{'id': '6629f4ff0fc1d300125e6e2a', 'value': 'Beginner (B1)'}, {'id': '6629f4ff0fc1d300125e6e2b', 'value': 'Intermediate (B2)'}, {'id': '6629f4ff0fc1d300125e6e2c', 'value': 'Advanced (C1)'}, {'id': '6629f4ff0fc1d300125e6e2d', 'value': 'Fluent (C2)'}]}}, {'id': '658132226d1e8400133fd98b', 'type': 'radio', 'title': 'As a global team, we communicate in English daily: our internal communication, procedural documentation, and meetings are in English. Do you feel confident, and comfortable communicating in English?', 'mandatory': True, 'description': None, 'radio': {'options': [{'id': '6629f4ff0fc1d300125e6e2e', 'value': 'Yes, I feel confident.'}, {'id': '6629f4ff0fc1d300125e6e2f', 'value': ""No, I'm not quite there yet.""}]}}, {'id': '658132226d1e8400133fd98e', 'type': 'radio', 'title': 'Are you comfortable with a monthly payment ranging between Rp5.000.000-Rp6.500.000 (excluding bonuses & commissions)?', 'mandatory': True, 'description': None, 'radio': {'options': [{'id': '6629f4ff0fc1d300125e6e30', 'value': 'Yes, it meets my expectation'}, {'id': '6629f4ff0fc1d300125e6e31', 'value': ""No. it's below my expectation""}]}}, {'id': '658132226d1e8400133fd97e', 'type': 'radio', 'title': 'How long have you been working with EN to ID and vice versa localization?', 'mandatory': True, 'description': None, 'radio': {'options': [{'id': '6629f4ff0fc1d300125e6e32', 'value': 'Less than 1 year'}, {'id': '6629f4ff0fc1d300125e6e33', 'value': '1-2 years'}, {'id': '6629f4ff0fc1d300125e6e34', 'value': 'More than 2 years'}]}}, {'id': '658132226d1e8400133fd982', 'type': 'longText', 'title': 'Are you familiar with CAT (Computer-Assisted Translation) tools? If yes, please mention CAT tools that you are most familiar with. If not, you can put N/A', 'mandatory': True, 'description': None}, {'id': '659643d1f156e500121a9e2f', 'type': 'radio', 'title': 'Do you have any experience in digital marketing / SEO?', 'mandatory': True, 'description': None, 'radio': {'options': [{'id': '6629f4ff0fc1d300125e6e35', 'value': 'Yes, I have experience on it'}, {'id': '6629f4ff0fc1d300125e6e36', 'value': ""I'm currently learning on it""}, {'id': '6629f4ff0fc1d300125e6e37', 'value': ""No, I don't have any experience on it""}]}}, {'id': '6605a6aee02c24001207c543', 'type': 'longText', 'title': 'What are your career goals, and how would working in this role help you achieve those?', 'mandatory': True, 'description': None}, {'id': '6605a6aee02c24001207c544', 'type': 'longText', 'title': 'What called your attention to apply to this position at Hostinger?', 'mandatory': True, 'description': None}]",active,37,,,,False,[],,[],True,,False,False,0,False,[],2023-12-19T05:19:49.121Z,2024-06-25T06:43:06.760Z,2024-06-24T14:58:26.483Z,2024-06-24T14:58:26.483Z,"[{'canSeeApplicants': True, 'email': 'doa.sucinta@hostinger.com', 'canViewSalary': True, 'canProcessCandidate': True, 'order': 1}, {'canSeeApplicants': True, 'email': 'putri.rahman@hostinger.com', 'canViewSalary': True, 'canProcessCandidate': True, 'order': 2}]",True,False,2024-06-21T10:07:33.226Z,7,8,8,False,,,,,,,,,"[5, 6]",,,"['62fb6a8e723f400012934a56', '62b5de0370db360014e64563', '6226f6692d9a642279775a7f', '65f157154d6643001268106c']","[{'id': '62fb6a8e723f400012934a56', 'name': 'Technical SEO', 'addedByUser': True, 'editedBy': None, 'status': 'notProcessed', 'count': 122, 'createdAt': '2022-08-16T09:59:42.225Z'}, {'id': '62b5de0370db360014e64563', 'name': 'English To Indonesia Translation', 'addedByUser': True, 'editedBy': None, 'status': 'notProcessed', 'count': 413, 'createdAt': '2022-06-24T15:53:39.296Z'}, {'id': '6226f6692d9a642279775a7f', 'name': 'CAT Tools', 'addedByUser': False, 'editedBy': None, 'status': 'notProcessed', 'count': 5, 'createdAt': '2022-03-07T17:00:00.000Z'}, {'id': '65f157154d6643001268106c', 'name': 'Marketing Translation', 'addedByUser': True, 'editedBy': None, 'status': 'notProcessed', 'count': 0, 'createdAt': '2024-03-13T07:34:45.617Z'}]",7591,15,62a838e7115f840012904d19,Hostinger,hostinger-international,"Our vision is to help thousands of business owners build their online presence with high-performing websites.

As we grow as the biggest hosting company in Indonesia, we need more talented people, like you, to empower our clients.",,,"['periodLeave', 'freeMeals', 'medicalLeave']",['workFromAnywhere'],Information Technology / IT,https://cdn.sejutacita.id/650cf75ee988fd001339e51f/JobPortalCompanyLogo/617e2f10-decf-4f8b-b0a6-fee411f4e21f.png,,"<p>Since 2004, Hostinger has been a web host on a mission to break down all barriers to achieving success online. Everyone can unlock the power of the internet, and we are committed to making this happen.</p><p><br></p><p>With nearly 900 employees worldwide, we’ve established a growth-focused workplace culture that brings out the best in everyone. Are you someone who takes ownership of projects? Do you have a thirst for knowledge and an eye for detail? Is being proactive and assertive something that comes naturally to you? We’d love to hear from you!</p>",https://www.hostinger.co.id/,hostinger.com,,,,2022-06-14T07:29:43.723Z,2024-06-25T04:19:28.958Z,227,Yogyakarta,102,Indonesia,"['balanced', 'quality', 'fast-paced']","[{'id': 'balanced', 'name': 'Balanced', 'subtitle': 'For us, employee productivity is just as important as their well-being', 'createdAt': '2022-04-27T14:55:08.596Z'}, {'id': 'quality', 'name': 'Quality', 'subtitle': 'We put great emphasis on preserving the high existing standard of our products/services', 'createdAt': '2022-04-27T14:55:08.596Z'}, {'id': 'fast-paced', 'name': 'Fast-paced', 'subtitle': 'Swift in handling new challenges and producing new ideas to improve', 'createdAt': '2022-04-27T14:55:08.596Z'}]",,,,,,False,True,['HRFriend'],,False,a prominent web-hosting services company which has served 500K+ customers in Indonesia,2160,"[{'linkedInUrl': 'https://www.linkedin.com/in/doassucinta/', 'role': 'Talent Acquisition and Retention Specialist', 'headline': None, 'name': 'Doa Sri Sucinta', 'photoUrl': 'https://cdn.sejutacita.id/63feb42adf6141001385ccf9/Others/492a0d61-aa7f-4667-ba8e-62be0ecf37a4.jpeg'}, {'linkedInUrl': 'https://www.linkedin.com/in/putri-aida-r/', 'role': 'Talent Acquisition and Retention Specialist', 'headline': None, 'name': 'Putri Aida Rahman', 'photoUrl': 'https://cdn.sejutacita.id/63feb42adf6141001385ccf9/Others/4ceb5900-3935-47ea-b886-13da95a240b0.jpeg'}]",2023-03-07T03:26:14.541Z,False,3,,[],[],[],[],False,0,-1,,,13459589,niagahoster,hostinger-international,0,True,True,63e0c23d8c574700140623a5,riani.pratiwi@usedeall.com,5000000.0,6500000.0,,,,,,
