,id,companyId,authorId,categoryId,role,slugPrimarySegment,slugSecondarySegment,slug,closed,userSavedJob,saved,description,responsibilities,requirements,perks,customPerks,invitedEmails,employmentTypes,workplaceType,salaryType,salaryRange,cvRequired,portofolioRequired,reminderToProcessFirstCandidatesIsSent,published,publishedAt,preScreeningQuestions,status,applicantLimitCount,eligibleToApply,jobApplication,author,higherChance,previewedCandidates,candidateCount,recruitmentSteps,sendRejectionEmailNeeded,higherSalary,pausedEmailIsSent,closedEmailIsSent,blastCount,careerFair,careerFairEventIds,createdAt,updatedAt,latestUpdatedAt,updatedAtByEmployer,hiringTeam,showSalaryToApplicants,urgentlyNeeded,employerLastSignedInAt,applicantCount,applicantQuota,applicantPrioritySlots,thereAreStillFewApplicants,category.id,category.name,category.createdAt,location.country.id,location.country.name,location.city.id,location.city.name,candidatePreference.major,candidatePreference.lastEducations,candidatePreference.university,candidatePreference.minimumGpa,candidatePreference.skillIds,candidatePreference.skills,stats.viewCount,stats.nonCuratedCount,company.id,company.name,company.slug,company.headline,company.insight.fundingStage,company.insight.fundingAmount,company.insight.benefits,company.insight.workingPolicies,company.sector,company.logoUrl,company.headerUrl,company.description,company.website,company.emailDomain,company.size.start,company.size.end,company.subscription,company.createdAt,company.updatedAt,company.location.city.id,company.location.city.name,company.location.country.id,company.location.country.name,company.cultures,company.populatedCultures,company.whatSpecial,company.jobCount,company.applicantCount,company.deletedAt,company.reasonToDelete,company.bestCompany,company.jobIntegration,company.howToKnowDeall,company.socialMedia,company.sendApplicationRejectedEmailEnabled,company.achievement,company.profileViewCount,company.featuredMembers,company.featuredMembersFirstUpdatedAt,company.featuredMembersCompleted,company.completeFeaturedMembersReminderSentCount,company.type,company.selectedCompanyPhotoIds,company.selectedCompanyPhotos,company.highlights,company.adminSuggestedHighlights,company.useSuggestedHighlights,company.downloadedCVCount,company.downloadCVQuota,company.trialHistory,company.owner,company.linkedinId,company.oldSlugBeforeNewRevamp,company.slugPrimarySegment,company.slugSecondarySegment,company.highlightSuggestionChecked,company.verified,editor.userId,editor.email,salaryRange.start,salaryRange.end,company.socialMedia.instagram,company.socialMedia.twitter,category,location,eligibleToApply.status,eligibleToApply.reason
0,667520a449565400123f7b40,6674fdf4495654001237d0f4,6674fd686eca6a00135574f6,630cfd2551c6b2001373125e,Leader Telemarketing,leader-telemarketing,0,leader-telemarketing,False,,False,,"<ul><li>Mampu memimpin sekitar 20 telemarketing</li><li>mampu memimpin tim untuk mencapai target harian,mingguan dan bulanan</li><li>mampu memotivasi sales untuk mencapai target</li></ul>",<ul><li>pendidikan min. SMA/SMK</li><li>Min. Pengalaman 1 tahun di leader telemarketing perbankan</li></ul>,[],,[],['fullTime'],onSite,paid,,True,False,False,True,2024-06-21T06:41:40.927Z,"[{'id': '6678d7374956540012b2fcfe', 'type': 'numeric', 'title': 'Usia', 'mandatory': True, 'description': None}]",active,39,,,,False,[],,[],True,,False,False,0,False,[],2024-06-21T06:41:40.935Z,2024-06-25T06:44:23.036Z,2024-06-24T04:21:48.857Z,2024-06-24T04:21:48.857Z,"[{'canSeeApplicants': True, 'email': 'hr@dealls-ranajaya.com', 'canViewSalary': True, 'canProcessCandidate': True, 'order': 1}]",False,True,2024-06-25T01:50:44.645Z,7,8,8,False,630cfd2551c6b2001373125e,Business Dev & Sales,2022-08-29T17:53:41.250Z,102.0,Indonesia,185.0,Depok,,"[5, 6]",,,[],[],937,39,6674fdf4495654001237d0f4,PT. Ranajaya Mulia Sentosa,pt-ranajaya-mulia-sentosa,,,,"['medicalLeave', 'bonusSystem', 'periodLeave']",['onSite'],Recruitment Service and Consultant,https://cdn.sejutacita.id/6674fd686eca6a00135574f6/JobPortalCompanyLogo/8277e9c5-177b-4244-8484-a395fee21e1d.jpeg,,"<p>PT. Ranajaya Mulia Sentosa, berdiri pada tahun 2006, adalah perusahaan yang spesialis dalam layanan telemarketing untuk memasarkan produk perbankan, terutama produk CONSUMER FINANCE dari berbagai lembaga keuangan. Dengan pengalaman lebih dari 15 tahun, Ramusen adalah ahli tepercaya dalam penjualan produk KTA/PERSONAL LOAN, KARTU KREDIT, dan MULTIGUNA LEASEBACK (Jaminan BPKB Kendaraan). Layanan kami mencakup Telemarketing, ROBO CALLER, dan Pemasaran Digital. Kami berkomitmen untuk memberikan layanan terbaik dan solusi keuangan kepada masyarakat Indonesia.</p>",https://www.ramusen.com/,dealls-ranajaya.com,1,50,,2024-06-21T04:13:40.932Z,2024-06-25T05:39:09.774Z,185,Depok,102,Indonesia,[],[],,,,,,False,True,['friend'],,False,,15,[],,False,0,,[],[],[],[],False,0,-1,,,,,pt-ranajaya-mulia-sentosa,0,True,False,63e0c23d8c574700140623a5,riani.pratiwi@usedeall.com,,,,,,,,
1,6676671449565400126a5ab4,6622418707b2ea001331cf58,66224095de1786001471941a,630cfecf51c6b2001373136d,E-Commerce Manager,e-commerce-manager,0,e-commerce-manager,False,,False,,"<p><br></p><ul><li>Mengevaluasi kinerja team dan admin secara rutin mulai dari Pre-Sales, Fullfilment sampai dengan After-Sales terutama untuk Market Place</li><li>Mengimplentasi Strategi penjualan dengan tepat dan efektif</li><li>Mengelola semua aktivitas online yang berkaitan dengan perolehan traffic acquisition, sales, conversion and a/b testing and reporting</li><li>Mengembangkan dan menerapkan ecommerce marketing strategy dalam rangka meningkatkan awareness dan penjualan di seluruh online channel</li><li>Melakukan Market Research untuk menemukan potensi dan peluang baru</li><li>Menjaga dan meningkatkan performa dari penjualan via marketplace</li></ul>","<p><br></p><ul><li>Minimal Pendidikan D3 / S1</li><li>Memiliki pengalaman kerja sebagai e-Commerce Manager / Marketing Manager minimal 2-3 tahun</li><li>Memiliki pengalaman / familiar dengan Marketplace</li><li>Memiliki kemampuan berkomunikasi baik secara lisan maupun tertulis dengan anggota team</li><li>Memiliki jiwa leadership dan bertanggung jawab</li><li>Memiliki kemampuan problem solving</li><li>Dapat bekerja secara teliti dan detail</li><li>Dapat mengoperasi Ms Word, Excel dan Power Point</li></ul>",[],,['business@wiradiutamapackindo.id'],['fullTime'],onSite,paid,,True,False,False,True,2024-06-22T05:54:53.467Z,"[{'id': '6678d76b4956540012b30d6f', 'type': 'longText', 'title': 'What is your biggest achievement int his role?', 'mandatory': True, 'description': None}]",active,45,,,,False,[],,[],True,,False,False,0,False,[],2024-06-22T05:54:28.272Z,2024-06-25T06:44:23.036Z,2024-06-22T05:54:28.269Z,2024-06-25T06:11:40.529Z,"[{'canSeeApplicants': True, 'email': 'business@wiradiutamapackindo.id', 'canViewSalary': True, 'canProcessCandidate': True, 'order': 1}]",True,True,2024-06-21T10:15:28.997Z,7,8,8,False,630cfecf51c6b2001373136d,Marketing & Social Media,2022-08-29T18:00:47.758Z,102.0,Indonesia,49180.0,Jakarta,,"[5, 6]",,,"['62b976207e07610012e576e7', '6226f6692d9a642279775aab', '62a81737115f8400129033d7', '62c662bc38af2c0014ae3e62', '6226f6692d9a642279775aaf']","[{'id': '62b976207e07610012e576e7', 'name': 'E-Commerce', 'addedByUser': True, 'editedBy': None, 'status': 'notProcessed', 'count': 431, 'createdAt': '2022-06-27T09:19:28.745Z'}, {'id': '6226f6692d9a642279775aab', 'name': 'Leadership', 'addedByUser': False, 'editedBy': None, 'status': 'notProcessed', 'count': 2694, 'createdAt': '2022-03-07T17:00:00.000Z'}, {'id': '62a81737115f8400129033d7', 'name': 'Social Media Marketing', 'addedByUser': True, 'editedBy': None, 'status': 'notProcessed', 'count': 2507, 'createdAt': '2022-06-14T05:05:59.994Z'}, {'id': '62c662bc38af2c0014ae3e62', 'name': 'Problem Solving Skill', 'addedByUser': True, 'editedBy': None, 'status': 'notProcessed', 'count': 3075, 'createdAt': '2022-07-07T04:36:12.568Z'}, {'id': '6226f6692d9a642279775aaf', 'name': 'Microsoft Office', 'addedByUser': False, 'editedBy': None, 'status': 'notProcessed', 'count': 11524, 'createdAt': '2022-03-07T17:00:00.000Z'}]",1119,73,6622418707b2ea001331cf58,PT Wiradi Utama Packindo,pt-wiradi-utama-packindo,,,,"['competitiveSalary', 'medicalLeave', 'bonusSystem', 'maternityLeave', 'paidSickDays']",['onSite'],Manufacturing (Packaging and Container ),https://cdn.sejutacita.id/66224095de1786001471941a/JobPortalCompanyLogo/60a866ed-2292-4298-82df-8f7cf5378e6c.jpg,,"<p>VISI “Menjadi supplier untuk memenuhi kebutuhan alat makan sekali pakai di seluruh Indonesia.”</p><p>Berangkat dari visi ini, Wiradi Utama Packindo melihat bahwa kebutuhan Food Packaging menjadi hal penting ditengah perkembangan industri F&amp;B khususnya delivery/take away . Terlebih, mulai menjamurnya makanan yang dijual via aplikasi online menbuat kebutuhan akan food packaging pakai semakin banyak. Karena itu, Wiradi Utama Packindo memiliki cita-cita untuk menjadi meningkatkan kualitas pelayanan di dunia F&amp;B dengan membantu para pemiliki dalam mencari food packaging berkualitas dengan harga yang terjangkau .</p><p>MISI :</p><p>Meningkatan kualitas food delivery industries di Indonesia dengan menyediakan alat makan dan kemasan yang premium, sehingga meningkatkan nilai tambah di mata customer.</p><p>Memberikan solusi inovatif di bidang kebutuhan-kebutuhan Hotel, Restoran &amp; Cafe.</p><p>Melakukan kerja sama jangka panjang dengan berbagai usaha/klien/partner/mitra di industri F&amp;B untuk memenuhi kebutuhan alat makan sekali pakai, meningkatkan kualitas food delivery, dan pemenuhan di segala kebutuhan F&amp;B delivery.</p>",https://wiradiutamapackindo.id/,wiradiutamapackindo.id,50,100,,2024-04-19T10:03:51.273Z,2024-06-25T06:02:43.755Z,49180,Jakarta,102,Indonesia,[],[],,,,,,False,True,['Referal'],,False,,285,"[{'linkedInUrl': None, 'role': 'CEO', 'headline': None, 'name': 'Fernandi Setiadi', 'photoUrl': 'https://cdn.sejutacita.id/66224095de1786001471941a/Others/4ae3eaf1-66b5-46c0-86a8-a99c6492f54b.jpg'}, {'linkedInUrl': None, 'role': 'COO', 'headline': None, 'name': 'Refaldi Wiryanto ', 'photoUrl': 'https://cdn.sejutacita.id/66224095de1786001471941a/Others/62430f5c-d608-4f4c-87cc-07e59c3372b1.jpeg'}]",2024-04-20T09:26:52.110Z,False,2,nonStartup,[],[],[],[],False,0,-1,,,,,pt-wiradi-utama-packindo,0,True,True,63e0c23d8c574700140623a5,riani.pratiwi@usedeall.com,5000000.0,10000000.0,,,,,,
2,6674fa2b3271ea001289795a,637ae41895712d0012308aac,637c80fa8b42270014a9d872,630cfd2551c6b2001373125e,Sales lead Generator,sales-lead-generator,0,sales-lead-generator,False,,False,,"<ul><li>design and delivery of campaigns to identify and/or reach prospective customers of the Product(s) (e.g., email campaigns, social media campaigns, prospective customer meetings, webinars, list buys).</li><li>design and delivery of brand awareness campaign(s), either in traditional or digital media, highlighting the Product(s) alone or in association with another product or solution working with the Product(s).</li><li>design and launch programs to drive sales personnel to promote the Product(s) and to collaborate on Google initiatives.</li></ul>",<ul><li>Minimal 3 years in a similar role</li></ul>,[],,['hrd@eikontechnology.com'],['fullTime'],onSite,paid,,True,False,False,True,2024-06-21T03:57:31.102Z,[],active,34,,,,False,[],,[],True,,False,False,0,False,[],2024-06-21T03:57:31.109Z,2024-06-25T06:44:58.353Z,2024-06-21T03:57:31.105Z,2024-06-23T14:01:50.820Z,"[{'canSeeApplicants': True, 'email': 'hrd@eikontechnology.com', 'canViewSalary': True, 'canProcessCandidate': True, 'order': 1}]",False,True,2024-06-11T16:10:16.332Z,7,8,7,False,630cfd2551c6b2001373125e,Business Dev & Sales,2022-08-29T17:53:41.250Z,102.0,Indonesia,49180.0,Jakarta,,"[5, 6, 7]",,,"['62f2029b7794da00120c22d8', '622b0e91be5455658672490a']","[{'id': '62f2029b7794da00120c22d8', 'name': 'Telesales', 'addedByUser': True, 'editedBy': None, 'status': 'notProcessed', 'count': 144, 'createdAt': '2022-08-09T06:45:47.184Z'}, {'id': '622b0e91be5455658672490a', 'name': 'Sales Management', 'addedByUser': False, 'editedBy': None, 'status': 'notProcessed', 'count': 721, 'createdAt': '2022-03-10T17:00:00.000Z'}]",2012,76,637ae41895712d0012308aac,PT. EIKON Technology,pt-eikon-technology,,,,"['competitiveSalary', 'medicalLeave', 'dentalInsurance', 'companyOutings', 'bonusSystem', 'professionalDevelopment', 'internationalExposure']","['flexible', 'onSite', 'workFromAnywhere', 'hybrid']",Information Technology,https://cdn.sejutacita.id/6379eaca7f270f00141a2d6f/JobPortalCompanyLogo/e10a968f-2bc4-4758-8b1c-dd12023aa1be.png,,"<p>PT. EIKON Technology (EIKON) is a privately held information technology consulting, outsourcing, and development firm founded in 2007. Ever since, EIKON has been Google Enterprise Partner and being the expert in cloud computing service provider. EIKON works with its client base to develop innovative technology solutions to business challenges.</p>",https://eikontechnology.com/,eikontechnology.com,1,50,,2022-11-21T02:36:08.414Z,2024-06-25T06:17:48.201Z,49180,Jakarta,102,Indonesia,"['integrity', 'collaborative', 'fast-paced']","[{'id': 'integrity', 'name': 'Integrity', 'subtitle': 'We uphold honesty and virtue in every single product/service we deliver', 'createdAt': '2022-04-27T14:55:08.596Z'}, {'id': 'collaborative', 'name': 'Collaborative', 'subtitle': 'Here, we work together to make the dream work', 'createdAt': '2022-04-27T14:55:08.596Z'}, {'id': 'fast-paced', 'name': 'Fast-paced', 'subtitle': 'Swift in handling new challenges and producing new ideas to improve', 'createdAt': '2022-04-27T14:55:08.596Z'}]",,,,,,False,True,['linkedin'],,False,"EIKON designs, delivers, deploys and supports a holistic, cutting-edge suite of best-of-breed technologies. This allows organizations to leverage Information Technology to achieve new levels of effectiveness, efficiency, and collaboration. Through years of experience and strategic partnerships with countless business organizations, EIKON has developed methodologies that lead to solutions that don't just get the job done, but improve processes which give enterprises the maximum competitive edge.
",1516,"[{'linkedInUrl': 'https://www.linkedin.com/in/josephineprisilia/', 'role': 'Operations Manager', 'headline': None, 'name': 'Josephine Prisilia', 'photoUrl': 'https://cdn.sejutacita.id/637c80fa8b42270014a9d872/Others/8885a7ae-99b2-4b02-a7f9-524009ede879.jpeg'}, {'linkedInUrl': 'https://www.linkedin.com/in/johannescandra/', 'role': 'CEO, Director', 'headline': None, 'name': 'Johannes Candra', 'photoUrl': 'https://cdn.sejutacita.id/63983cf268e6b200152ce01f/Others/35e227ea-342d-4cfc-bf8d-5afaed23541d.jpg'}]",2023-01-19T05:10:41.454Z,False,3,nonStartup,[],[],[],[],False,0,-1,,,3333956,eikon-technology-09dd23,pt-eikon-technology,0,True,True,63e0c23d8c574700140623a5,riani.pratiwi@usedeall.com,,,,,,,,
3,66753b3057830e00120eb382,6675320756155400131e1c75,66753155653c1b00128e0b87,630cff8c9c338f0012831274,Accounting Tax Manager,accounting-tax-manager,3,accounting-tax-manager-3,False,,False,,"<p><br></p><ul><li>Menyusun laporan keuangan dan melaksanakan strategi perpajakan sesuai dengan bisnis koperasi</li><li>Mengelola proses pelaporan pajak, termasuk penyusunan laporan pajak tahunan, PPh 21, PPh 23, PPN, dan lain-lain</li><li>Melakukan analisis pajak untuk mengidentifikasi potensi risiko dan peluang perpajakan</li><li>Berkoordinasi dengan tim internal dan eksternal untuk penyelesaian masalah perpajakan</li><li>Memastikan proses pelaporan pajak berjalan dengan efisien dan akurat</li><li>Mengelola dan mengawasi semua kegiatan akuntansi perusahaan, termasuk pemrosesan transaksi harian, pelaporan keuangan, dan audit internal</li><li>Memastikan ketaatan perusahaan terhadap standar akuntansi dan peraturan perpajakan yang berlaku</li><li>Menyusun dan menganalisis laporan keuangan bulanan, kuartalan, dan tahunan</li><li>Memimpin proses audit internal dan eksternal</li><li>Mengembangkan dan menerapkan prosedur akuntansi yang efisien dan efektif</li><li>Berkolaborasi dengan departemen lain untuk analisis biaya, perencanaan anggaran, dan strategi keuangan</li><li>Mampu membuat strategi kebijakan keuangan yang tepat yang berpacu pada data</li><li>Mampu untuk melakukan <em>forecast</em> keuangan perusahaan</li></ul>","<ul><li>S1 jurusan Akuntansi</li><li>Pengalaman minimal 2 tahun diposisi yang sama</li><li>Memiliki sertifikasi Akuntan Profesional (CPA/CA) dihargai</li><li>Memiliki sertifikasi pajak Brevet A/B</li><li>Handal dalam mengoperasikan MS Office khususnya MS Excel</li><li>Memiliki pengetahuan yang kuat tentang standar akuntansi dan peraturan perpajakan serta perhitungannya</li><li>Mampu menggunakan perangkat lunak akuntansi dan sistem manajemen keuangan dengan baik</li><li>Memiliki kemampuan kepemimpinan yang baik, mampu berkomunikasi dengan jelas dan bekerja sama dengan tim</li><li>Memiliki <em>self-driven </em>yang baik, kemampuan interpersonal yang kuat serta memiliki motivasi tinggi</li></ul>",[],,[],['fullTime'],onSite,paid,,True,False,False,True,2024-06-21T08:34:56.650Z,"[{'id': '64844687827a42e574746f17', 'type': 'date', 'title': ""When's your birthday?"", 'mandatory': True, 'description': None}]",active,48,,,,False,[],,[],True,,False,False,0,False,[],2024-06-21T08:34:56.667Z,2024-06-25T06:44:23.036Z,2024-06-21T08:34:56.657Z,2024-06-21T08:34:56.650Z,"[{'canSeeApplicants': True, 'email': 'recruitment@kspdwitunggal.com', 'canViewSalary': True, 'canProcessCandidate': True, 'order': 1}]",False,True,2024-06-24T07:27:35.061Z,7,8,8,False,630cff8c9c338f0012831274,Finance & Accounting,2022-08-29T18:03:56.071Z,102.0,Indonesia,159.0,Jakarta Timur,,"[5, 6]",,,[],[],1130,47,6675320756155400131e1c75,KSP DWI TUNGGAL,ksp-dwi-tunggal,,,,"['competitiveSalary', 'bonusSystem', 'periodLeave']",['onSite'],Financial Services,https://cdn.sejutacita.id/66753155653c1b00128e0b87/JobPortalCompanyLogo/e5e8dcdf-db8d-4903-81a1-fd958cc3b209.jpg,,"<p>Koperasi Simpan Pinjam (KSP) Dwi Tunggal di dirikan berdasarkan Akta No. 13 tanggal 30 November 2009 oleh Notaris Nurhasanah, SH, Mkn. Notaris di Bekasi. Dan telah mendapat pengesahan dari Kementerian Negara Koperasi dan Usaha Kecil dan Menengah Republik Indonesia dalam Surat Keputusan Nomor : 901/BH/M. KUKM.2/IV/201 tanggal 19 April 2010. KSP Dwi tunggal saat ini telah mempunyai titik pelayanan yang tersebar di 6 provinsi yaitu : Provinsi DKI Jakarta Provinsi Banten Provinsi Jawa Barat Provinsi Jawa Tengah Provinsi Daerah Istimewa Yogyakarta Provinsi Jawa Timur VISI Membangun ekonomi bersama untuk kesejahteraan masyarakat MISI - Bersama kita ciptakan kesempatan tumbuh dan berkembang - Memberikan pelayanan yang berkualitas cepat dan transparan - Menggerakan produk perekonomian sesuai dengan teori ekonomi MOTTO Tumbuh Sejahtera Bersama Produk Kami - Penempatan Simpanan Berjangka KSP Dwi Tunggal menyediakan simpanan berjangka bagi para Anggota yang memiliki perencanaan keuangan. - Penyediaan Pinjaman Pensiunan KSP Dwi Tunggal menawarkan produk pinjaman kredit bagi para Pensiunan Pegawai TNI, POLRI, VETERAN dan SIPIL</p>",https://kspdwitunggal.com/,kspdwitunggal.com,50,100,,2024-06-21T07:55:51.540Z,2024-06-25T04:18:11.943Z,159,Jakarta Timur,102,Indonesia,[],[],,,,,,False,True,['sdr'],,False,,13,[],,False,0,,[],[],[],[],False,0,-1,,,,,ksp-dwi-tunggal,0,True,False,63e0c23d8c574700140623a5,riani.pratiwi@usedeall.com,,,,,,,,
4,667502e2c7b9ed001215fc66,6674e794495654001231c8ba,6674e7296eca6a00135568c0,630cff8c9c338f0012831274,Internal Control,internal-control,1,internal-control-1,False,,False,,<ul><li>Melakukan pemeriksaan SOP</li><li>Melakukan Sock Opname</li><li>Membua Laporan Audit</li><li>Melakukan Analisis Data</li><li>Monitoring Pelaksanaan Perbaikan Hasil Audit</li></ul>,"<p><br></p><ul><li>Pendidikan min. S1 Akuntansi / Manajemen (Keuangan).</li><li>Memiliki kemampuan problem solving &amp; decision making yang mumpuni.</li><li>Komunikatif, berintegritas tinggi, detail, kritis, bertanggung jawab, profesional dan berperilaku baik.</li><li>Menguasai penggunaan Ms. Office (terutama Ms. Excel).</li><li>Bersedia untuk melakukan perjalanan dinas luar kota.</li><li>Bersedia ditempatkan di Kebayoran Lama, Jakarta Selatan.</li></ul>",[],,[],['fullTime'],onSite,paid,,True,False,False,True,2024-06-21T04:40:34.556Z,"[{'id': '64844687827a42e574746f17', 'type': 'date', 'title': ""When's your birthday?"", 'mandatory': True, 'description': None}, {'id': '648446cf827a42e574746f18', 'type': 'numeric', 'title': ""What's your latest GPA/IPK?"", 'mandatory': True, 'description': None}]",active,48,,,,False,[],,[],True,,False,False,0,False,[],2024-06-21T04:34:42.539Z,2024-06-25T06:44:50.173Z,2024-06-21T04:34:42.537Z,2024-06-22T00:49:35.433Z,"[{'canSeeApplicants': True, 'email': 'recruitment@sumbersaranaputra.com', 'canViewSalary': True, 'canProcessCandidate': True, 'order': 1}]",False,True,2024-06-21T04:57:50.677Z,7,8,8,False,630cff8c9c338f0012831274,Finance & Accounting,2022-08-29T18:03:56.071Z,102.0,Indonesia,158.0,Jakarta Selatan,,"[0, 5]",,,"['6226f6692d9a642279775a76', '62752cfb7ca701001342fc9b', '6226f6692d9a642279775ac4', '633ec94527db990013bb7502', '62fe05e61e10ce0014a7cd19']","[{'id': '6226f6692d9a642279775a76', 'name': 'Auditing', 'addedByUser': False, 'editedBy': None, 'status': 'notProcessed', 'count': 622, 'createdAt': '2022-03-07T17:00:00.000Z'}, {'id': '62752cfb7ca701001342fc9b', 'name': 'Accounting', 'addedByUser': True, 'editedBy': None, 'status': 'notProcessed', 'count': 5420, 'createdAt': '2022-05-06T14:13:15.022Z'}, {'id': '6226f6692d9a642279775ac4', 'name': 'Risk Management', 'addedByUser': False, 'editedBy': None, 'status': 'notProcessed', 'count': 436, 'createdAt': '2022-03-07T17:00:00.000Z'}, {'id': '633ec94527db990013bb7502', 'name': 'Tax Reporting', 'addedByUser': True, 'editedBy': None, 'status': 'notProcessed', 'count': 41, 'createdAt': '2022-10-06T12:25:41.354Z'}, {'id': '62fe05e61e10ce0014a7cd19', 'name': 'Finance Management', 'addedByUser': True, 'editedBy': None, 'status': 'notProcessed', 'count': 418, 'createdAt': '2022-08-18T09:27:02.087Z'}]",948,197,6674e794495654001231c8ba,PT Sumber Sarana Putra,pt-sumber-sarana-putra,,,,"['medicalLeave', 'bonusSystem', 'periodLeave']",['onSite'],Construction,https://cdn.sejutacita.id/6674e7296eca6a00135568c0/JobPortalCompanyLogo/625bd4d2-19b8-443e-8209-f8f48702db49.jpeg,,"<p>PT Sumber Sarana Putra adalah perusahaan yang bergerak di bidang industri dan distribusi bahan bangunan terutama besi dan baja. Kami telah berdiri sejak tahun 1982 dan telah memiliki 16 cabang yang tersebar di beberapa daerah di Indonesia, serta 1 sister company yang berlokasi di Bali, Indonesia.</p>",https://www.linkedin.com/company/ptsumbersaranaputra/,sumbersaranaputra.com,,,,2024-06-21T02:38:12.684Z,2024-06-25T05:11:16.953Z,49180,Jakarta,102,Indonesia,[],[],,,,,,False,True,['friend'],,False,,24,[],,False,0,,[],[],[],[],False,0,-1,,,,,pt-sumber-sarana-putra,0,True,False,63e0c23d8c574700140623a5,riani.pratiwi@usedeall.com,,,,,,,,
