12,667a2ca06f8c260012ca7b2a,6466d409f2900d0012ad1c7d,66455cee07cff600134b8eaa,6567386a2c68190012508d9d,Product Development Supervisor,product-development-supervisor,0,product-development-supervisor,False,,False,,<p><strong>Job Description:</strong></p><ul><li>Develop new product</li><li>Improve existing product to get better formula</li><li>Ensure the development are aligned with company and BPOM regulations</li><li>Manage the team to deliver report properly</li></ul>,"<p><strong>Job Requirements:</strong></p><ul><li>Experienced in handling development of food products (preferable: milk powder)</li><li>Graduated from Food Technology major</li><li>Knowledge and Skills: Food material analysis, do formulation, and able to manage team</li><li>Attitude: Willing to learn, detail oriented</li></ul><p><strong>Other Information:</strong></p><ul><li>Placement: Cakung, Jakarta Timur</li></ul>",[],,['robby.faryansyah@kalbenutritionals.com'],['fullTime'],onSite,paid,,True,False,False,True,2024-06-25T02:34:08.997Z,"[{'id': '667a4e4e6f8c260012d2d0e0', 'type': 'radio', 'title': 'Do you willing to Work From Office in our Site at Cakung, Jakarta Timur?', 'mandatory': True, 'description': None, 'radio': {'options': [{'id': '667a4e4e6f8c260012d2d0e1', 'value': 'Yes'}, {'id': '667a4e4e6f8c260012d2d0e2', 'value': 'No'}]}}]",active,14,,,,False,[],,[],True,,False,False,0,False,[],2024-06-25T02:34:09.009Z,2024-06-25T06:44:51.663Z,2024-06-25T02:34:09.004Z,2024-06-25T03:16:40.151Z,"[{'canSeeApplicants': True, 'email': 'robby.faryansyah@kalbenutritionals.com', 'canViewSalary': True, 'canProcessCandidate': True, 'order': 1}]",False,False,2024-06-20T08:28:47.983Z,7,8,8,True,6567386a2c68190012508d9d,Health & Science,2023-11-29T13:11:06.259Z,102.0,Indonesia,159.0,Jakarta Timur,,[5],,,[],[],24,13,6466d409f2900d0012ad1c7d,Kalbe Nutritionals (PT Sanghiang Perkasa),kalbe-nutritionals-pt-sanghiang-perkasa,,,,"['competitiveSalary', 'medicalLeave', 'periodLeave', 'bonusSystem']",['onSite'],Food And Beverage Services,https://cdn.sejutacita.id/63983cf268e6b200152ce01f/JobPortalCompanyLogo/a3c10481-d776-4ff5-9b1a-976a4cde92a8.png,,"<p>Didirikan dengan nama PT Sanghiang Perkasa, selama ini kami dikenal masyarakat sebagai Kalbe Health Foods Division dari PT Kalbe Farma Tbk., perusahaan farmasi terkemuka di Indonesia. Guna meningkatkan kinerja perusahaan dan lebih mendekatkan diri kepada konsumen, pada tahun 2007 kami melakukan perubahan brand identity perusahaan. Melalui proses seksama, nama Kalbe Farma Health Foods Division akhirnya diubah menjadi Kalbe Nutritionals. Corporate brand identity baru yang membawa nama Kalbe ini mempertegas kepercayaan kami sebagai perusahaan yang sudah memiliki reputasi tinggi. Wajah baru tersebut sekaligus mempertajam komitmen kami dalam bidang bisnis makanan kesehatan dan komitmen akan pentingnya kehidupan.&nbsp;&nbsp;</p><p><br></p><p>Nurturing Life Through Science (Memelihara Kehidupan Melalui Ilmu Pengetahuan) adalah pernyataan tegas semangat kami untuk tiada henti mendayagunakan kemajuan ilmu pengetahuan demi lebih baiknya kehidupan manusia. Semangat itu akan menjadi sumber motivasi dan inspirasi kami untuk mengembangkan brand-brand yang terpercaya, pengembangan produk yang intensif dan layanan pelanggan yang unggul.&nbsp;&nbsp;</p><p><br></p><p>Karena sadar akan pentingnya mempromosikan bahwa hidup ini adalah anugerah yang harus dijaga kemuliaan dan keindahannya, kami meluncurkan produk-produk makanan kesehatan di setiap titik kritis tahap pertumbuhan dan perkembangan manusia. Mulai sejak dalam kandungan, masa pertumbuhan dan perkembangan, masa puncak karir, sampai pada tahap usia emas mereka saat kinerja tubuh mulai berkurang. Kami ingin memastikan bahwa di sepanjang titik kritis kehidupan manusia itu, produk Kalbe Nutritionals dapat hadir menemani konsumen agar bisa menikmati hidup sebagai perjalanan yang penuh berkat.&nbsp;Live the Best of Your Life.&nbsp;</p><p><br></p><p><strong>More information and any question please visit :</strong>Website : www.kalbenutritionals.com</p>",https://kalbenutritionals.com/,kalbenutritionals.com,,,,2023-05-19T01:42:33.890Z,2024-06-25T06:42:20.724Z,160,Jakarta Utara,102,Indonesia,"['adaptable', 'innovative', 'trustworthy']","[{'id': 'adaptable', 'name': 'Adaptable', 'subtitle': 'Our team is flexible and resilient in the face of adversities', 'createdAt': '2022-04-27T14:55:08.596Z'}, {'id': 'innovative', 'name': 'Innovative', 'subtitle': 'We strive to constantly pursue innovation of our products and services', 'createdAt': '2022-04-27T14:55:08.596Z'}, {'id': 'trustworthy', 'name': 'Trustworthy', 'subtitle': ""Consistently making an all-out effort to sustain people's trust of our products/services"", 'createdAt': '2022-04-27T14:55:08.596Z'}]","<p>We inspired by Panca Sradha that become our strong values, which are :</p><ol><li>Trust is The Glue of Life</li><li>Mindfulness is a Foundation of Our Action</li><li>Innovation is The Key to Our Success</li><li>Strive to Be The Best</li><li>Interconnectedness is The Universal Way of Life</li></ol>",,,,,False,True,['SDR'],,False,,29316,"[{'linkedInUrl': 'https://www.linkedin.com/in/maria-immaculata-ayu-prameswari-4b611b88/', 'role': 'Talent Acquisition Lead ', 'headline': 'Experienced Senior Recruiter with experience of working in the Consultant & Corporate', 'name': 'Maria Immaculata Ayu Prameswari', 'photoUrl': 'https://cdn.sejutacita.id/6466d3262275c500133bf975/Others/6eb800fa-ce51-484c-b222-fee918ceb172.jpeg'}, {'linkedInUrl': 'https://www.linkedin.com/in/alya-zahra-322a95173/', 'role': 'Talent Acquisition Specialist', 'headline': 'Experienced Senior Recruiter with experience of working in corporate industry', 'name': 'Alya Zahra', 'photoUrl': 'https://cdn.sejutacita.id/6466d3262275c500133bf975/Others/deb9ea06-7178-4819-9498-4c9275a0e3e8.jpg'}, {'linkedInUrl': 'https://www.linkedin.com/in/kristoforus-yunico-2050731aa/', 'role': 'Talent Acquisition Specialist', 'headline': 'Experienced Senior Recruiter with experience of working in corporate industry', 'name': 'Kristoforus Yunico', 'photoUrl': 'https://cdn.sejutacita.id/6466d3262275c500133bf975/Others/dfa73148-b090-4e10-95d2-93c1f4679415.jpg'}]",2023-05-19T02:48:22.896Z,True,0,nonStartup,[],[],[],[],False,0,-1,,,72294411,kalbe-nutritionals-pt-sanghiang-perkasa-285851,kalbe-nutritionals-pt-sanghiang-perkasa,0,True,True,63e0c23d8c574700140623a5,riani.pratiwi@usedeall.com,,,,,,,,
13,667a5805c6750e0012a7bde0,642d07dd4fb3eb001260f9d2,642d049617d0d40013923c88,630cfc029c338f0012830fb7,Database Administrator,database-administrator,7,database-administrator-7,False,,False,,"<p><strong>What you will do</strong></p><ul><li>Monitor the DB performance for slow queries, indexes and various other DB metrics</li><li>Ensure best practices of database access and security</li><li>Work closely with the Development teams to review the DB schema changes in every release cycle</li><li>Setting up database cluster, replication</li><li>Perform Database migration and performance monitoring tools</li><li>Ability to learn new technologies as required by the role</li></ul>","<p><strong>Person we are looking for:</strong></p><ul><li>A minimum of 3 years experience as Database Administrator</li><li>Bachelor's degree in computer science, information systems or related field</li><li>Proficient in SQL, database backup and recovery, performance tuning and optimization</li><li>Familiar with database security best practices and compliance standards</li><li>Familiar with setting up database cluster and replication</li><li>Experience with cloud platforms such as AWS, Azure or Google Cloud</li><li>Experience working with NOSQL databases like Document DB etc., is a bonus</li><li>Experience in automating tasks for database monitoring (using code), is a bonus</li><li>Point plus, If you have experience or interest in working as a site reliability engineer (SRE), you will have an edge over other candidates. As an SRE, you will apply software engineering principles to ensure the reliability, scalability and efficiency of our systems. You will also monitor, troubleshoot and automate various aspects of our infrastructure and operations</li></ul>",[],,['laili.rizki@sg-edts.com'],['fullTime'],onSite,paid,,True,False,False,True,2024-06-25T05:39:17.418Z,"[{'id': '667a59ada0a4fd0012ffff73', 'type': 'longText', 'title': 'How many year your experience as Database Administrator?', 'mandatory': True, 'description': None}, {'id': '667a59ada0a4fd0012ffff74', 'type': 'longText', 'title': 'When are you available to start in EDTS? ', 'mandatory': True, 'description': None}]",active,1,,,,False,[],,[],True,,False,False,0,False,[],2024-06-25T05:39:17.424Z,2024-06-25T06:33:40.642Z,2024-06-25T05:39:17.421Z,2024-06-25T05:39:17.418Z,"[{'canSeeApplicants': True, 'email': 'laili.rizki@sg-edts.com', 'canViewSalary': True, 'canProcessCandidate': True, 'order': 1}]",False,False,2024-06-19T02:01:09.917Z,3,8,8,True,630cfc029c338f0012830fb7,Data & Product Management,2022-08-29T17:48:50.228Z,102.0,Indonesia,157.0,Jakarta Pusat,,"[6, 7, 5]",,,"['63dba7fd8a9b490013aaa79a', '62da83f52aa8890012bcf9d4', '62a826f9115f840012903e37', '62a326e162a37400158df2fa', '65278216b369ad0013132b5d']","[{'id': '63dba7fd8a9b490013aaa79a', 'name': 'GCP', 'addedByUser': True, 'editedBy': None, 'status': 'notProcessed', 'count': 4, 'createdAt': '2023-02-02T12:09:33.445Z'}, {'id': '62da83f52aa8890012bcf9d4', 'name': 'SQLITE', 'addedByUser': True, 'editedBy': None, 'status': 'notProcessed', 'count': 47, 'createdAt': '2022-07-22T11:03:17.572Z'}, {'id': '62a826f9115f840012903e37', 'name': 'Database Management', 'addedByUser': True, 'editedBy': None, 'status': 'notProcessed', 'count': 310, 'createdAt': '2022-06-14T06:13:13.919Z'}, {'id': '62a326e162a37400158df2fa', 'name': 'Amazon Web Services (AWS)', 'addedByUser': True, 'editedBy': None, 'status': 'notProcessed', 'count': 293, 'createdAt': '2022-06-10T11:11:29.341Z'}, {'id': '65278216b369ad0013132b5d', 'name': 'DBA', 'addedByUser': True, 'editedBy': None, 'status': 'notProcessed', 'count': 1, 'createdAt': '2023-10-12T05:20:22.224Z'}]",6,1,642d07dd4fb3eb001260f9d2,SG-EDTS,sg-edts,,,,"['competitiveSalary', 'medicalLeave', 'bonusSystem', 'periodLeave', 'maternityLeave', 'dentalInsurance', 'wellnessProgram', 'casualDressCode', 'teamBuilding', 'freeMeals', 'professionalDevelopment']","['onSite', 'flexible']",IT Services And IT Consulting,https://cdn.sejutacita.id/642d049617d0d40013923c88/JobPortalCompanyLogo/a22e0efe-f96f-454a-834e-21b74dd253c2.jpeg,,"<p>In the fast-paced world of technology, disruption is the norm. That's why EDTS was created - to democratize digital technology and make it accessible to everyone. And since 2019, we've been the Digital Center of Excellence for Salim Group.</p><p><br></p><p>Our team of digital experts is here to help companies navigate the ever-changing landscape of technology and harness its power to transform their business. Our vision is simple - to improve the welfare of the country by helping organizations achieve their full potential.</p><p><br></p><p>At EDTS, we're on a mission to help our clients seize new opportunities and prepare for the future by leveraging digital technology and data science. Our values of Integrity, Respect, Positive Impact, Growth, and Operational Excellence guide us in everything we do.</p><p><br></p><p>Join us on this journey of digital transformation, where we help companies stay ahead of the curve and achieve their goals in this rapidly changing world.</p>",https://www.sg-edts.com,sg-edts.com,50,100,,2023-04-05T05:32:13.345Z,2024-06-25T05:46:21.838Z,49180,Jakarta,102,Indonesia,"['collaborative', 'fast-paced', 'integrity']","[{'id': 'collaborative', 'name': 'Collaborative', 'subtitle': 'Here, we work together to make the dream work', 'createdAt': '2022-04-27T14:55:08.596Z'}, {'id': 'fast-paced', 'name': 'Fast-paced', 'subtitle': 'Swift in handling new challenges and producing new ideas to improve', 'createdAt': '2022-04-27T14:55:08.596Z'}, {'id': 'integrity', 'name': 'Integrity', 'subtitle': 'We uphold honesty and virtue in every single product/service we deliver', 'createdAt': '2022-04-27T14:55:08.596Z'}]",,,,,,False,True,['SDR'],,False,,1706,"[{'linkedInUrl': 'https://www.linkedin.com/in/ivanjonatan/', 'role': 'CEO at EDTS', 'headline': None, 'name': 'Ivan J.', 'photoUrl': 'https://cdn.sejutacita.id/63983cf268e6b200152ce01f/Others/2eaf6cb7-8715-4ef3-8327-0bff519d9303.jpg'}, {'linkedInUrl': 'https://www.linkedin.com/in/jonathan-kurniawan-b80b8529/', 'role': 'Chief Technology Officer at PT EDTS (Elevenia Digital Teknologi Sukses)', 'headline': None, 'name': 'Jonathan Kurniawan', 'photoUrl': 'https://cdn.sejutacita.id/63983cf268e6b200152ce01f/Others/c34a689a-a5f9-4493-8e2e-59d22525186d.jpg'}, {'linkedInUrl': 'https://www.linkedin.com/in/laili-rizki-yuliana-062139a9/', 'role': 'Senior Recruiter at SG-EDTS', 'headline': None, 'name': 'Laili Rizki Yuliana', 'photoUrl': 'https://cdn.sejutacita.id/63983cf268e6b200152ce01f/Others/85c7269a-0b36-4ec5-8cd8-e201b7de70b0.jpg'}]",,False,3,nonStartup,[],[],[],[],False,0,-1,,,14732082,sg-edts-41f7cd,sg-edts,0,True,True,63e0c23d8c574700140623a5,riani.pratiwi@usedeall.com,,,https://www.instagram.com/edts_sg/?hl=en,,,,,
14,667a4d87a0a4fd0012fd70c8,65cd9deb9708220012214f42,662b8697de17860014750d36,630cfd2551c6b2001373125e,Sales Representative,sales-representative,25,sales-representative-25,False,,False,,"<p>As a Sales Representative at GoVisa, you will be responsible for generating new business opportunities and driving revenue growth. You will play a key role in promoting our services, building relationships with potential customers, and ensuring a smooth and efficient sales process.</p><ul><li>Identify and pursue new sales leads through various channels, including chat, phone call, email, and social media.</li><li>Build and maintain strong relationships with prospective customers.</li><li>Understand customers’ needs and provide tailored solutions to meet their visa requirements.</li><li>Present and demonstrate the benefits of GoVisa’s services to potential customers.</li><li>Achieve and exceed sales targets and quotas on a daily and monthly basis.</li><li>Collaborate with the marketing team to develop and execute effective sales strategies.</li></ul>","<ul><li>Proven experience in sales, preferably in the visa, immigration, or travel industry.</li><li>Excellent communication and interpersonal skills.</li><li>Strong negotiation and closing skills.</li><li>Ability to work independently and as part of a team.</li><li>Self-motivated with a results-oriented mindset.</li><li>Proficient in using CRM software and other sales tools.</li><li>Strong organizational and time management skills.</li><li>Bachelor’s degree in Business, Marketing, or a related field is preferred.</li></ul>",[],,['nirmala@govisa.id'],['fullTime'],onSite,paid,,True,False,False,True,2024-06-25T04:54:31.863Z,[],active,3,,,,False,[],,[],True,,False,False,0,False,[],2024-06-25T04:54:31.870Z,2024-06-25T06:15:34.893Z,2024-06-25T04:54:31.865Z,2024-06-25T04:54:31.863Z,"[{'canSeeApplicants': True, 'email': 'nirmala@govisa.id', 'canViewSalary': True, 'canProcessCandidate': True, 'order': 1}]",True,False,2024-05-27T05:59:27.096Z,5,8,8,True,630cfd2551c6b2001373125e,Business Dev & Sales,2022-08-29T17:53:41.250Z,102.0,Indonesia,158.0,Jakarta Selatan,,[5],,,"['62da790158c12f00123e74c4', '627950dc9fbcad00126234c3', '62a476be1bf51600123c49dc', '6226f6692d9a642279775aa6', '6355f019e9a38f001258a6d2']","[{'id': '62da790158c12f00123e74c4', 'name': 'Communication Skills', 'addedByUser': True, 'editedBy': None, 'status': 'notProcessed', 'count': 2420, 'createdAt': '2022-07-22T10:16:33.158Z'}, {'id': '627950dc9fbcad00126234c3', 'name': 'Customer Relationship Management (CRM)', 'addedByUser': True, 'editedBy': None, 'status': 'notProcessed', 'count': 1147, 'createdAt': '2022-05-09T17:35:24.487Z'}, {'id': '62a476be1bf51600123c49dc', 'name': 'Empathy', 'addedByUser': True, 'editedBy': None, 'status': 'notProcessed', 'count': 55, 'createdAt': '2022-06-11T11:04:30.292Z'}, {'id': '6226f6692d9a642279775aa6', 'name': 'Interpersonal skills', 'addedByUser': False, 'editedBy': None, 'status': 'notProcessed', 'count': 675, 'createdAt': '2022-03-07T17:00:00.000Z'}, {'id': '6355f019e9a38f001258a6d2', 'name': 'Interpersonal Communication', 'addedByUser': True, 'editedBy': None, 'status': 'notProcessed', 'count': 677, 'createdAt': '2022-10-24T01:53:29.793Z'}]",8,3,65cd9deb9708220012214f42,GoVisa (YC S22),govisa,,,,"['competitiveSalary', 'internationalExposure', 'casualDressCode', 'bonusSystem']",['onSite'],Travel/Tourism,https://cdn.sejutacita.id/65cd9d161370c4001319c8b6/JobPortalCompanyLogo/88b0fcdf-8911-461a-b3bf-f7f68ac963f8.png,,<p>We’re enabling millions of Indonesians to travel abroad effortlessly with the simplest visa application process in Indonesia.</p>,https://govisa.id,govisa.id,1,50,,2024-02-15T05:15:23.891Z,2024-06-25T05:41:13.891Z,158,Jakarta Selatan,102,Indonesia,"['innovative', 'collaborative', 'fast-paced']","[{'id': 'innovative', 'name': 'Innovative', 'subtitle': 'We strive to constantly pursue innovation of our products and services', 'createdAt': '2022-04-27T14:55:08.596Z'}, {'id': 'collaborative', 'name': 'Collaborative', 'subtitle': 'Here, we work together to make the dream work', 'createdAt': '2022-04-27T14:55:08.596Z'}, {'id': 'fast-paced', 'name': 'Fast-paced', 'subtitle': 'Swift in handling new challenges and producing new ideas to improve', 'createdAt': '2022-04-27T14:55:08.596Z'}]",,,,,,False,True,['Linkedin'],,False,,2645,"[{'linkedInUrl': 'https://www.linkedin.com/in/gerynugraha/', 'role': 'CTO', 'headline': None, 'name': 'Putu Gery Wahyu Nugraha', 'photoUrl': 'https://cdn.sejutacita.id/65cd9d161370c4001319c8b6/Others/c7116756-435e-4a8e-809c-9e98249c90fa.jpeg'}, {'linkedInUrl': 'https://www.linkedin.com/in/ffahleraz/', 'role': 'CEO', 'headline': None, 'name': 'Faza Fahleraz', 'photoUrl': 'https://cdn.sejutacita.id/65cd9d161370c4001319c8b6/Others/b7bf2340-17ec-418a-86db-e04e3303622f.jpeg'}, {'linkedInUrl': 'https://www.linkedin.com/in/albertsahala/', 'role': 'COO', 'headline': None, 'name': 'Albert Sahala Theodore', 'photoUrl': 'https://cdn.sejutacita.id/65cd9d161370c4001319c8b6/Others/17b12258-e80a-4d2a-85ee-49090a46d46b.jpeg'}]",2024-02-15T05:18:39.426Z,False,3,nonStartup,[],[],[],[],False,0,-1,,,,,govisa,0,True,True,63e0c23d8c574700140623a5,riani.pratiwi@usedeall.com,6000000.0,7500000.0,,,,,,
15,6645d96720fc1900126bd669,6464c78df2900d0012a658e8,6464c675ff4fe80013c4b6ce,65673827e7adcf001210f96e,Call Center,call-center,0,call-center,False,,False,,<ul><li>Menerima panggilan masuk dari customer dan Menjawab setiap pertanyaan yang diberikan oleh customer.</li><li>Memberikan informasi terkait dengan produk perusahaan.</li><li>Menangani setiap complain yang diberikan oleh customer.</li><li>Melakukan interaksi secara langsung dengan customer untuk memberikan informasi terkait dengan kebutuhan mereka.</li></ul>,<p><br></p><ul><li>Pendidikan Min SMA/SMK/Sederajat</li><li>Pengalaman dan non pengalaman.</li><li>Memiliki tutur kata yang baik dan ramah.</li><li>Mampu berkomunikasi dengan baik.</li></ul>,[],,['hrd3@royalfx.co.id'],['fullTime'],onSite,paid,,True,False,False,True,2024-05-16T10:01:11.255Z,"[{'id': '6645d99b0ccd820012993617', 'type': 'numeric', 'title': 'Usia', 'mandatory': True, 'description': '18-28'}]",active,13,,,,False,[],,[],True,,False,False,0,False,[],2024-05-16T10:01:11.261Z,2024-06-25T06:42:13.786Z,2024-06-25T04:21:53.150Z,2024-06-25T06:42:13.785Z,"[{'canSeeApplicants': True, 'email': 'hrd3@royalfx.co.id', 'canViewSalary': True, 'canProcessCandidate': True, 'order': 1}]",True,False,2024-06-25T04:51:36.631Z,7,8,8,False,65673827e7adcf001210f96e,Admin & Ops,2023-11-29T13:09:59.360Z,102.0,Indonesia,158.0,Jakarta Selatan,,"[4, 0, 5, 6, 7]",,,"['6354b44807330c001455aa17', '62c662bc38af2c0014ae3e62', '641e34f2c3b4060012b4ca47', '629f366762a37400158c3b96', '6226f6692d9a642279775a8a']","[{'id': '6354b44807330c001455aa17', 'name': 'Customer Support', 'addedByUser': True, 'editedBy': None, 'status': 'notProcessed', 'count': 421, 'createdAt': '2022-10-23T03:26:00.874Z'}, {'id': '62c662bc38af2c0014ae3e62', 'name': 'Problem Solving Skill', 'addedByUser': True, 'editedBy': None, 'status': 'notProcessed', 'count': 3075, 'createdAt': '2022-07-07T04:36:12.568Z'}, {'id': '641e34f2c3b4060012b4ca47', 'name': 'Teamwork', 'addedByUser': True, 'editedBy': None, 'status': 'notProcessed', 'count': 519, 'createdAt': '2023-03-24T23:40:34.926Z'}, {'id': '629f366762a37400158c3b96', 'name': 'Customer Engagement', 'addedByUser': True, 'editedBy': None, 'status': 'notProcessed', 'count': 244, 'createdAt': '2022-06-07T11:28:39.809Z'}, {'id': '6226f6692d9a642279775a8a', 'name': 'Customer Experience', 'addedByUser': False, 'editedBy': None, 'status': 'notProcessed', 'count': 521, 'createdAt': '2022-03-07T17:00:00.000Z'}]",1258,70,6464c78df2900d0012a658e8,ROYAL TRUST,royal-trust,,,,"['professionalDevelopment', 'bonusSystem', 'transport', 'teamBuilding']",['onSite'],"Private Equity, Investment Banking, Venture Capital",https://cdn.sejutacita.id/6464c675ff4fe80013c4b6ce/JobPortalCompanyLogo/bdc0284a-ce45-4c00-ba11-03553ba8ede5.png,,"<p>PT. Royal Trust adalah perusahaan perdagangan yang didirikan pada tahun 2005 dibawah naungan Kementrian Perdagangan dan telah memiliki ijin resmi, diawasi oleh BAPPEBTI sejak tahun 2006, menjadi anggota BBJ sejak tahun 2005 dan menjadi anggota KBI sejak tahun 2012 Sebagai salah satu perusahaan perdagangan komoditi terkemuka di Indonesia, PT. Royal Trust telah diakui baik dari sisi kepatuhan terhadap hukum, maupun prestasi lainnya. PT. Royal Trust yang bergerak di bidang Perdagangan Multilateral dan Derivatif, dalam aktivitas perdagangan berpijak pada nilai-nilai profesionalisme, edukasi dan pelayanan yang berkualitas sesuai dengan standar perdagangan berjangka nasional dan internasional serta didukung oleh para professional yang berpengalaman di industri tersebut. Melalui penyediaan informasi dan layanan berkualitas, PT Royal Trust berupaya menjaga tingkat kepuasan nasabah.</p>",https://royalfx.co.id/,royalfx.co.id,,,,2023-05-17T12:24:45.888Z,2024-06-25T05:28:55.662Z,158,Jakarta Selatan,102,Indonesia,"['innovative', 'fast-paced', 'progressive']","[{'id': 'innovative', 'name': 'Innovative', 'subtitle': 'We strive to constantly pursue innovation of our products and services', 'createdAt': '2022-04-27T14:55:08.596Z'}, {'id': 'fast-paced', 'name': 'Fast-paced', 'subtitle': 'Swift in handling new challenges and producing new ideas to improve', 'createdAt': '2022-04-27T14:55:08.596Z'}, {'id': 'progressive', 'name': 'Progressive', 'subtitle': 'Continuous ambition for progress and finding the best means to make it happen', 'createdAt': '2022-04-27T14:55:08.596Z'}]",,,,,,False,True,['Google'],,False,,2481,"[{'linkedInUrl': 'https://www.linkedin.com/in/chory-siauw-1750ab21a/', 'role': 'Recruitment Specialist', 'headline': None, 'name': 'Chory Siauw  ', 'photoUrl': 'https://cdn.sejutacita.id/6464c675ff4fe80013c4b6ce/Others/277cddac-8977-47d8-8aac-f3ffb3b10c46.png'}]",,False,3,nonStartup,"['65a7581a7b971400122c938b', '65a7582d1b3b8c00138f668d']",[],[],[],False,0,-1,,,14633318,royal-trust-f6ff31,royal-trust,0,True,True,63e0c23d8c574700140623a5,riani.pratiwi@usedeall.com,4000000.0,5000000.0,https://www.instagram.com/royaltrustfutures/,,,,,
