44,66793648c6750e00127dc1af,66724320d5254b0012fbb724,6672412b653c1b00128cfbe1,630cfc029c338f0012830fb7,Senior Product Manager,senior-product-manager,8,senior-product-manager-8,False,,False,,"<ul><li>Lead the <strong>Product Catalog</strong> squad to manage AlloFresh assortments and pricing</li><li>Ensure AlloFresh product availability</li><li>Create mid to long term plan for Product Catalog team</li><li>Drive the squad’s north star metrics</li><li>Translate product strategy into product plan, detailed requirements, and prototypes</li><li>Manage the product development lifecycle, including planning, prioritization, and execution</li><li>Ensure product quality and on-time delivery</li><li>Conduct deep analysis on product availability and decide on the next steps</li><li>Identify issues and improvement opportunities that can push the products / features’ performance forward</li></ul>","<ul><li>Bachelor’s degree in Engineering / Computer Science / Business or related fields</li><li>Minimum of 6 years of relevant work experience in product management, preferably with a focus on retail, warehouse management, and/or operations</li><li>Solid understanding of product development cycle</li><li>Ability to manage stakeholders from various level and functions</li><li>Proven ability to work in a fast-paced, agile environment, and manage multiple projects simultaneously</li><li>Excellent analytical and problem-solving skills, with the ability to leverage data to drive informed decisions</li><li>Strong verbal and written communication skill (Bahasa Indonesia &amp; English)</li><li>Strong drive to achieve objectives and charisma to influence other</li></ul>",[],,['cut.kallysta@allofresh.id'],['fullTime'],onSite,paid,,True,False,False,True,2024-06-24T09:03:04.249Z,[],active,25,,,,False,[],,[],True,,False,False,0,False,[],2024-06-24T09:03:04.254Z,2024-06-25T06:07:31.254Z,2024-06-24T09:03:04.252Z,2024-06-24T09:03:04.248Z,"[{'canSeeApplicants': True, 'email': 'cut.kallysta@allofresh.id', 'canViewSalary': True, 'canProcessCandidate': True, 'order': 1}]",False,False,2024-06-24T08:51:17.959Z,7,8,7,False,630cfc029c338f0012830fb7,Data & Product Management,2022-08-29T17:48:50.228Z,102.0,Indonesia,158.0,Jakarta Selatan,,[7],,,[],[],64,18,66724320d5254b0012fbb724,AlloFresh,allofresh,,,,"['competitiveSalary', 'bonusSystem', 'medicalLeave', 'maternityLeave', 'paidSickDays', 'dentalInsurance', 'teamBuilding', 'companyOutings']","['hybrid', 'onSite']",E-commerce and Online Retail,https://cdn.sejutacita.id/6672412b653c1b00128cfbe1/JobPortalCompanyLogo/85f2f430-f561-4303-a9e5-ada44fcaa42c.jfif,,"<p>Introducing your new friend to fulfill all your daily needs - AlloFresh, supermarket at your doorstep! Established in early 2022, AlloFresh is a joint venture company between Bukalapak, an all-commerce unicorn company, and Trans Retail Indonesia, a giant retail company under CT Corp Group. AlloFresh focuses on providing fast delivery across Indonesia. We offers a wide range of products to meet the diverse needs of our customers.</p>",https://allofresh.id/,allofresh.id,,,,2024-06-19T02:32:00.528Z,2024-06-25T06:42:24.503Z,158,Jakarta Selatan,102,Indonesia,[],[],,,,,,False,True,['LinkedIn'],,False,,82,[],,False,0,nonStartup,[],[],[],[],False,0,-1,,,,,allofresh,0,True,True,63e0c23d8c574700140623a5,riani.pratiwi@usedeall.com,,,,,,,,
45,6679255cc6750e001279b7b6,65544847ce415c0011869377,655445b3958a18001313d02c,630cfecf51c6b2001373136d,Online Shop Retail,online-shop-retail,0,online-shop-retail,False,,False,,"<p><br></p><ul><li>Mengelola Toko Online Di Shopee, Tokopedia, Blibli dan platform serupa</li><li>Mengelola Campaign yang tersedia di Marketplace</li><li>Setting Ads Marketplace di Shopee, Tokopedia, Blibli dan platform serupa</li><li>Report hasil Campaign dan Ads</li><li>Berkoordinasi dengan masing-masing RM (Relationship&nbsp;Manager) di Marketplace</li><li>Memastikan semua pesanan diproses dengan cepat dan tepat melalui koordinasi dengan tim gudang</li><li>Handle complain serta berkoordinasi dengan atasan</li></ul>","<p><br></p><ul><li><strong>Pengalaman 1 tahun di bidang yang sama</strong></li><li><strong>Tidak sedang melanjutkan studi</strong></li><li>Pengalaman menangani ads di Shopee, Tokopedia, Blibli dan platform lainnya</li><li>Terbiasa dengan SOP untuk menangani Marketplace toko resmi, operasional, penggunggahan produk, deskripsi produk dan keterampilan apapun yang berkaitan dengan Marketplace</li><li>Memiliki pengalaman bekerja dengan Marketplace RM (Relationship Manager)</li><li>Termotivasi dengan target</li><li>Dapat bergabung secepatnya</li><li><strong>Bersedia di tempatkan di seluruh cabang Agres (JABODETABEK, Surabaya dan Bandung)</strong></li></ul>",[],,['hrd@agres.co.id'],['fullTime'],onSite,paid,,True,False,False,True,2024-06-24T07:50:52.733Z,[],active,20,,,,False,[],,[],True,,False,False,0,False,[],2024-06-24T07:50:52.739Z,2024-06-25T06:07:30.126Z,2024-06-24T07:50:52.737Z,2024-06-24T07:50:52.733Z,"[{'canSeeApplicants': True, 'email': 'hrd@agres.co.id', 'canViewSalary': True, 'canProcessCandidate': True, 'order': 1}]",False,False,2024-06-24T07:44:16.335Z,7,8,8,False,630cfecf51c6b2001373136d,Marketing & Social Media,2022-08-29T18:00:47.758Z,102.0,Indonesia,160.0,Jakarta Utara,,[5],,,[],[],38,19,65544847ce415c0011869377,PT Agres Info Teknologi,pt-agres-info-teknologi,,,,"['competitiveSalary', 'bonusSystem', 'periodLeave']",['onSite'],Computer Hardware,https://cdn.sejutacita.id/655445b3958a18001313d02c/JobPortalCompanyLogo/3951c21f-b934-4693-8ffc-0202640eb2ea.jpg,,"<p>PT Agres Info Teknologi (AIT) was started a business in 2003. We aims to offer a wide variety of computer which meet our costumer needs. As a growing company, we’re performed some significant progress. From a small computer shop to a master distribution company which handling various big brands in computer.</p><p><br></p><p>AIT is also a great company to work. Good things about working in AIT is a sharing culture between members. AIT believe that sharing will help each person to branch out themselves into a competitive and valuable person. Catch us up at www.agres.co.id for job opportunity.</p>",https://www.agres.co.id/,agres.co.id,100,,,2023-11-15T04:25:43.844Z,2024-06-24T20:09:35.130Z,49180,Jakarta,102,Indonesia,[],[],,,,,,False,True,['sdr'],,False,,55,[],,False,3,nonStartup,[],[],[],[],False,0,-1,,,,pt-agres-info-teknologi-2f6a0d,pt-agres-info-teknologi,0,True,True,63e0c23d8c574700140623a5,riani.pratiwi@usedeall.com,,,,,,,,
46,667917f26f8c260012a1d2b5,64c9f6c40fe9a80011806376,64c9f17fe988fd00132ab30e,65673827e7adcf001210f96e,Purchasing (Mandarin Speaker),purchasing-mandarin-speaker,1,purchasing-mandarin-speaker-1,False,,False,,"<ul><li>Mengelola dan memproses pembelian barang dan jasa sesuai kebutuhan perusahaan.</li><li>Melakukan negosiasi dengan vendor atau supplier untuk mendapatkan harga terbaik dan kualitas yang optimal.</li><li>Menyusun dan memelihara catatan pembelian, inventaris, dan laporan terkait.</li><li>Memastikan barang yang dibeli sesuai dengan spesifikasi dan tiba tepat waktu.</li><li>Berkoordinasi dengan departemen terkait untuk memastikan kebutuhan terpenuhi.</li><li>Melakukan evaluasi terhadap kinerja supplier dan mengembangkan hubungan baik dengan mereka.</li><li>Memantau stok barang dan mengelola persediaan untuk menghindari kelebihan atau kekurangan stok.</li><li>⁠Mengidentifikasi dan mengevaluasi potensi vendor baru untuk kebutuhan perusahaan.</li><li>Mengawasi dan mematuhi prosedur pembelian dan kebijakan perusahaan</li></ul>","<ul><li>Pendidikan minimal lulusan D3/S1 di bidang Manajemen, Akuntansi, Teknik Industri, atau bidang terkait.</li><li>Pengalaman kerja minimal 1 tahun di bidang purchasing atau procurement. Pengalaman di industri yang sama merupakan nilai tambah.</li><li>Wajib memiliki emampuan berbahasa Mandarin dan Inggris (lisan dan tulisan).</li><li>⁠⁠Bersedia ditempatkan di BSD, Tangerang</li></ul>",[],,['recruitment@evolene.co.id'],['fullTime'],onSite,paid,,True,False,False,True,2024-06-24T06:53:38.199Z,"[{'id': '667919178974d60012d59e0e', 'type': 'shortText', 'title': 'Pengalaman sebelumnya di Industri apa?', 'mandatory': True, 'description': None}, {'id': '64844628827a42e574746f16', 'type': 'numeric', 'title': ""What's your latest TOEFL score?"", 'mandatory': True, 'description': None}]",active,4,,,,False,[],,[],True,,False,False,0,False,[],2024-06-24T06:53:38.212Z,2024-06-25T06:07:28.885Z,2024-06-24T06:53:38.207Z,2024-06-24T06:53:38.199Z,"[{'canSeeApplicants': True, 'email': 'recruitment@evolene.co.id', 'canViewSalary': True, 'canProcessCandidate': True, 'order': 1}]",False,False,2024-06-19T10:18:26.940Z,6,8,8,True,65673827e7adcf001210f96e,Admin & Ops,2023-11-29T13:09:59.360Z,102.0,Indonesia,272.0,Tangerang,,"[5, 6, 7]",,,"['6284a5ae49476f0015ec3ca0', '6226f6692d9a642279775ab0', '63dcfc31a9d31e0013cd7b84']","[{'id': '6284a5ae49476f0015ec3ca0', 'name': 'Mandarin', 'addedByUser': True, 'editedBy': None, 'status': 'notProcessed', 'count': 52, 'createdAt': '2022-05-18T07:52:14.018Z'}, {'id': '6226f6692d9a642279775ab0', 'name': 'Negotiation', 'addedByUser': False, 'editedBy': None, 'status': 'notProcessed', 'count': 2728, 'createdAt': '2022-03-07T17:00:00.000Z'}, {'id': '63dcfc31a9d31e0013cd7b84', 'name': 'Komunikasi', 'addedByUser': True, 'editedBy': None, 'status': 'notProcessed', 'count': 459, 'createdAt': '2023-02-03T12:21:05.232Z'}]",45,4,64c9f6c40fe9a80011806376,PT Anugrah Inti Makmur Indonesia,pt-anugrah-inti-makmur-indonesia,,,,"['bonusSystem', 'competitiveSalary', 'medicalLeave', 'freeLunch']",['onSite'],Fitness,https://cdn.sejutacita.id/64c9f17fe988fd00132ab30e/JobPortalCompanyLogo/f6ebdb76-b139-4dfa-b514-872ce6e52805.png,,<p>PT Anugrah Inti Makmur Indonesia adalah brand suplemen kesehatan resmi dengan menciptakan produk-produk suplemen yang bisa dijangkau oleh seluruh lapisan rakyat Indonesia untuk mendukung olahraga dan kecantikan yang baik bagi kesehatan. Saat ini brand yang kita handle adalah <strong>Evolene </strong>dan <strong>Herwell</strong></p>,https://evolene.co.id,evolene.co.id,50,100,,2023-08-02T06:25:08.800Z,2024-06-25T06:29:44.030Z,272,Tangerang,102,Indonesia,"['respectful', 'innovative', 'collaborative']","[{'id': 'respectful', 'name': 'Respectful', 'subtitle': 'Everyone should be treated with courtesy and professionalism', 'createdAt': '2022-04-27T14:55:08.596Z'}, {'id': 'innovative', 'name': 'Innovative', 'subtitle': 'We strive to constantly pursue innovation of our products and services', 'createdAt': '2022-04-27T14:55:08.596Z'}, {'id': 'collaborative', 'name': 'Collaborative', 'subtitle': 'Here, we work together to make the dream work', 'createdAt': '2022-04-27T14:55:08.596Z'}]",,,,,,False,True,['HRfriend'],,False,,2021,[],,False,3,nonStartup,[],[],[],[],False,0,-1,,,71653791,evolene-indonesia-6402cd,pt-anugrah-inti-makmur-indonesia,0,True,True,63e0c23d8c574700140623a5,riani.pratiwi@usedeall.com,,,,,,,,
47,66798a3d960077001224ffd3,667930258974d60012db7abf,66792f19653c1b00128f2092,65673827e7adcf001210f96e,Koordinator Operasional,koordinator-operasional,0,koordinator-operasional,False,,False,,<p><strong>Job Description:</strong></p><ul><li>Bertanggung jawab dalam perencanaan dan pengelolaan operasional secara efektif dan efisien</li></ul>,<p><strong>Job Requirements:</strong></p><ol><li>Pendidikan diutamakan S1 Teknik Industri</li><li>Memiliki pengalaman minimal 2 tahun sebagai PPIC/Warehouse/Logistik</li><li>Menyukai pekerjaan planning &amp; organizing</li><li>Mampu bekerja dengan target</li><li>Diutamakan domisili area Jawa Timur</li></ol>,[],,[],['fullTime'],onSite,paid,,True,False,False,True,2024-06-24T15:01:17.091Z,[],active,3,,,,False,[],,[],True,,False,False,0,False,[],2024-06-24T15:01:17.099Z,2024-06-25T06:28:08.920Z,2024-06-24T15:01:17.094Z,2024-06-24T15:01:17.091Z,"[{'canSeeApplicants': True, 'email': 'career@anariasouvenir.com', 'canViewSalary': True, 'canProcessCandidate': True, 'order': 1}]",True,False,2024-06-25T02:06:54.725Z,5,8,8,True,65673827e7adcf001210f96e,Admin & Ops,2023-11-29T13:09:59.360Z,102.0,Indonesia,265.0,Surabaya,,[5],,,"['62c662bc38af2c0014ae3e62', '62e0b11257e9f300122ff63a', '6348b869aae05d0014e3c691', '62f9f122358a110012f189c2']","[{'id': '62c662bc38af2c0014ae3e62', 'name': 'Problem Solving Skill', 'addedByUser': True, 'editedBy': None, 'status': 'notProcessed', 'count': 3075, 'createdAt': '2022-07-07T04:36:12.568Z'}, {'id': '62e0b11257e9f300122ff63a', 'name': 'Team Leadership', 'addedByUser': True, 'editedBy': None, 'status': 'notProcessed', 'count': 1544, 'createdAt': '2022-07-27T03:29:22.162Z'}, {'id': '6348b869aae05d0014e3c691', 'name': 'Warehouse Management', 'addedByUser': True, 'editedBy': None, 'status': 'notProcessed', 'count': 1630, 'createdAt': '2022-10-14T01:16:25.997Z'}, {'id': '62f9f122358a110012f189c2', 'name': 'Planning And Organizing', 'addedByUser': True, 'editedBy': None, 'status': 'notProcessed', 'count': 252, 'createdAt': '2022-08-15T07:09:22.238Z'}]",20,3,667930258974d60012db7abf,CV Sakti Idea Craftindo,cv-sakti-idea-craftindo,,,,"['bonusSystem', 'teamBuilding', 'selfDevelopmentAllowance', 'professionalDevelopment']",['onSite'],Retail,https://cdn.sejutacita.id/66792f19653c1b00128f2092/JobPortalCompanyLogo/75ee2e4d-b3e0-4d9b-92ce-7bfb537bfdf4.jpg,,"<p>Anaria Souvenir merupakan vendor souvenir pernikahan elegan dan mewah. Anaria Souvenir memberikan cinta yang menyatu dalam kualitas brand, kualitas produk, kualitas packaging, dan kualitas pelayanan. Sejak tahun 2010, Anaria Souvenir telah berdedikasi untuk membuat souvenir dan hadiah dengan konsep yang modern, elegan dan mewah dengan detail dan pengetahuan tentang tren terkini, sekaligus menciptakan trend baru. Visi : Menjadi perusahaan penyedia souvenir pernikahan nomor 1 di Indonesia, unggul dalam produk, pelayanan &amp; sumber daya Misi : Pertumbuhan berkelanjutan melalui pengembangan terus menerus pada bidang: - Finansial - Market - Produk - Sistem &amp; Teknologi - Sumber daya Dalam rangka meningkatkan produktifitas kerja untuk mampu menghadapi berbagai tantangan di masa yang akan datang, Anaria Souvenir memiliki Budaya Kerja : APIIK 1. Adaptif 2. Produktif 3. Inovasi 4. Integritas 5. Kolaboratif</p>",https://anariasouvenir.com,anariasouvenir.com,1,50,,2024-06-24T08:36:53.747Z,2024-06-25T04:54:03.256Z,265,Surabaya,102,Indonesia,"['innovative', 'collaborative', 'integrity']","[{'id': 'innovative', 'name': 'Innovative', 'subtitle': 'We strive to constantly pursue innovation of our products and services', 'createdAt': '2022-04-27T14:55:08.596Z'}, {'id': 'collaborative', 'name': 'Collaborative', 'subtitle': 'Here, we work together to make the dream work', 'createdAt': '2022-04-27T14:55:08.596Z'}, {'id': 'integrity', 'name': 'Integrity', 'subtitle': 'We uphold honesty and virtue in every single product/service we deliver', 'createdAt': '2022-04-27T14:55:08.596Z'}]",,,,,,False,True,['TemanHR'],,False,,2,[],,False,0,,[],[],[],[],False,0,-1,,,,,cv-sakti-idea-craftindo,0,True,False,63e0c23d8c574700140623a5,riani.pratiwi@usedeall.com,4500000.0,5000000.0,,,,,,
48,6679461d6f8c260012acf8b1,6679448e6f8c260012acb498,6678efda653c1b00128efb5b,630cff8c9c338f0012831274,Accounting & Finance,accounting-and-finance,0,accounting-and-finance,False,,False,,"<p><br></p><p>As a Finance and Accounting Specialist, you will be responsible for managing all aspects of the company’s finance and accounting functions. Your primary duties will include:</p><ol><li>Preparing and maintaining monthly, quarterly, and annual financial reports.</li><li>Managing the company’s budget and conducting variance analysis.</li><li>Overseeing financial transactions, including accounts receivable and accounts payable.</li><li>Conducting bank reconciliations and monitoring cash flow.</li><li>Preparing tax reports and ensuring compliance with tax regulations.</li><li>Providing analytical support and financial recommendations to management.</li><li>Ensuring compliance with the company’s accounting policies and procedures.</li></ol>","<p><br></p><ol><li>Bachelor’s degree in Accounting, Finance, or a related field.</li><li>Minimum of 2 years of experience in finance and accounting, preferably in retail/distribution companies.</li><li>Strong understanding of accounting and finance principles.</li><li>Experience with accounting software (Accurate) and ERP systems.</li><li>Strong analytical skills and attention to detail.</li><li>Good communication skills and the ability to work in a team.</li><li>Professional certification in Brevet A&amp;B.</li><li>Knowledge of local and international tax regulations.</li><li>Experience with financial planning and analysis.</li></ol>",[],,[],['fullTime'],onSite,paid,,True,False,False,True,2024-06-24T10:10:37.957Z,[],active,25,,,,False,[],,[],True,,False,False,0,False,[],2024-06-24T10:10:37.966Z,2024-06-25T06:32:45.178Z,2024-06-24T10:10:37.962Z,2024-06-24T10:10:37.957Z,"[{'canSeeApplicants': True, 'email': 'kami@behr.co.id', 'canViewSalary': True, 'canProcessCandidate': True, 'order': 1}]",False,False,2024-06-24T10:03:58.244Z,7,8,8,False,630cff8c9c338f0012831274,Finance & Accounting,2022-08-29T18:03:56.071Z,102.0,Indonesia,273.0,Tangerang Selatan,,[5],,,"['6226f6692d9a642279775a98', '62fb98bdf5a7440012e24eac', '64bf779b626093001245e774', '64836e9ceaafc600123bc421', '62de70a9707b920013f8b490']","[{'id': '6226f6692d9a642279775a98', 'name': 'Financial Accounting', 'addedByUser': False, 'editedBy': None, 'status': 'notProcessed', 'count': 1261, 'createdAt': '2022-03-07T17:00:00.000Z'}, {'id': '62fb98bdf5a7440012e24eac', 'name': 'Accurate Online', 'addedByUser': True, 'editedBy': None, 'status': 'notProcessed', 'count': 694, 'createdAt': '2022-08-16T13:16:45.313Z'}, {'id': '64bf779b626093001245e774', 'name': 'Ms. Excel', 'addedByUser': True, 'editedBy': None, 'status': 'notProcessed', 'count': 21, 'createdAt': '2023-07-25T07:19:55.610Z'}, {'id': '64836e9ceaafc600123bc421', 'name': 'Tax Brevet A & B', 'addedByUser': True, 'editedBy': None, 'status': 'notProcessed', 'count': 45, 'createdAt': '2023-06-09T18:25:33.001Z'}, {'id': '62de70a9707b920013f8b490', 'name': 'Attention To Detail', 'addedByUser': True, 'editedBy': None, 'status': 'notProcessed', 'count': 897, 'createdAt': '2022-07-25T10:30:01.650Z'}]",63,24,6679448e6f8c260012acb498,BeHR Indonesia,behr-indonesia,,,,"['competitiveSalary', 'medicalLeave', 'bonusSystem', 'professionalDevelopment', 'teamBuilding', 'casualDressCode']",['onSite'],Human Resource Consulting,https://cdn.sejutacita.id/6678efda653c1b00128efb5b/JobPortalCompanyLogo/fae7c748-ece6-4cf8-95c7-4954cc6f2bd8.png,,<p>We are a company specializing in Human Resources consultant and People Management outsourcing services. BeHR maximizes the utilization of expertise and competencies in HR management through the implementation of an exceptional and reliable People Strategy and Development. BeHR has been developed by a group of people who are keen to see others growing. We dream of the raise of Indonesian small and mid size enterprises. Support the wealthiness of Indonesian people.</p>,https://behr.co.id,behr.co.id,1,50,,2024-06-24T10:03:58.143Z,2024-06-25T05:09:00.818Z,273,Tangerang Selatan,102,Indonesia,"['adaptable', 'collaborative', 'discipline']","[{'id': 'adaptable', 'name': 'Adaptable', 'subtitle': 'Our team is flexible and resilient in the face of adversities', 'createdAt': '2022-04-27T14:55:08.596Z'}, {'id': 'collaborative', 'name': 'Collaborative', 'subtitle': 'Here, we work together to make the dream work', 'createdAt': '2022-04-27T14:55:08.596Z'}, {'id': 'discipline', 'name': 'Discipline', 'subtitle': 'We seek to ensure that every individual contributes accordingly to the rules and agreement to achieve company objectives', 'createdAt': '2022-04-27T14:55:08.596Z'}]",,,,,,False,True,['TemanHR'],,False,,11,[],,False,0,,[],[],[],[],False,0,-1,,,,,behr-indonesia,0,True,False,63e0c23d8c574700140623a5,riani.pratiwi@usedeall.com,,,,,,,,
49,66794450c6750e001280f9a2,667941c5c6750e0012807b9a,6679405f6eca6a001356a94b,65673827e7adcf001210f96e,Customer Service,customer-service,18,customer-service-18,False,,False,,<ul><li>Menyediakan informasi produk dan layanan kepada pelanggan.</li><li>Menangani penjualan/sales secara offline dan online.</li><li>Menangani pertanyaan dan keluhan pelanggan dengan cepat dan tepat.</li><li>Menjaga hubungan baik dengan pelanggan dan memastikan kepuasan pelanggan.</li><li>Bekerja sama dengan tim marketing untuk mengembangkan strategi penjualan.</li></ul>,"<ul><li>Perempuan Muslimah</li><li>Minimal lulusan D3/S1 dari berbagai jurusan.</li><li>Pengalaman kerja di bidang Customer Service, Sales, atau Marketing minimal 1 tahun (tetap terbuka untuk freshgraduate).</li><li>Memiliki kemampuan komunikasi yang baik, baik lisan maupun tulisan.</li><li>Memiliki keterampilan interpersonal yang baik dan mampu bekerja dalam tim.</li><li>Menguasai penggunaan komputer/tech-savvy (Ms. Word, Excel, Shopee dlsb.)</li><li>Bersedia WFO di kantor pusat Surabaya.</li></ul>",[],,[],['fullTime'],onSite,paid,,True,False,False,True,2024-06-24T10:02:56.992Z,[],active,44,,,,False,[],,[],True,,False,False,0,False,[],2024-06-24T10:02:57.000Z,2024-06-25T06:44:34.440Z,2024-06-24T10:02:56.995Z,2024-06-24T10:02:56.991Z,"[{'canSeeApplicants': True, 'email': 'sahabat@wafaindonesia.or.id', 'canViewSalary': True, 'canProcessCandidate': True, 'order': 1}]",False,False,2024-06-24T09:52:05.578Z,7,8,8,False,65673827e7adcf001210f96e,Admin & Ops,2023-11-29T13:09:59.360Z,102.0,Indonesia,265.0,Surabaya,,"[0, 5]",,,[],[],103,43,667941c5c6750e0012807b9a,Wafa Indonesia,wafa-indonesia,,,,"['competitiveSalary', 'bonusSystem', 'selfDevelopmentAllowance', 'casualDressCode', 'companyOutings', 'paidSickDays']",['onSite'],Education & Training,https://cdn.sejutacita.id/6679405f6eca6a001356a94b/JobPortalCompanyLogo/0ce2f14f-a820-493d-bed2-2ff470a8f260.jpg,,"<p>Wafa adalah lembaga pengembang sistem dan manajemen pembelajaran Al-Qur’an yang memberikan solusi, training, produk dan layanan bagi kepala sekolah, koordinator, guru, peserta didik, walimurid, dan pengurus yayasan di berbagai lembaga formal dan informal yang telah digunakan di 35 provinsi di Indonesia dan beberapa negara lainnya.</p>",https://wafaindonesia.or.id,wafaindonesia.or.id,1,50,,2024-06-24T09:52:05.457Z,2024-06-25T04:22:24.792Z,265,Surabaya,102,Indonesia,"['respectful', 'open', 'fast-paced']","[{'id': 'respectful', 'name': 'Respectful', 'subtitle': 'Everyone should be treated with courtesy and professionalism', 'createdAt': '2022-04-27T14:55:08.596Z'}, {'id': 'open', 'name': 'Open', 'subtitle': 'Outstanding result stems from a free and welcoming enviroment', 'createdAt': '2022-04-27T14:55:08.596Z'}, {'id': 'fast-paced', 'name': 'Fast-paced', 'subtitle': 'Swift in handling new challenges and producing new ideas to improve', 'createdAt': '2022-04-27T14:55:08.596Z'}]",,,,,,False,True,['Linkedin'],,False,,11,[],,False,0,,[],[],[],[],False,0,-1,,,,,wafa-indonesia,0,True,False,63e0c23d8c574700140623a5,riani.pratiwi@usedeall.com,,,,,,,,
